annotation_lbl,categories,sentences
circled_fic_1853_9040.txt-653-25_circle_fic_1837_7452.txt-776-8,3 Closely Related 2 Distantly Related,"pour upon me thy soft beams, And circle me with heavenly streams. || pour upon me thy soft beams, And circle me with heavenly streams. || pour upon me thy soft beams, And circle me with heavenly streams. || pour upon me thy soft beams, And circle me with heavenly streams."
circled_fic_1854_7764.txt-1056-5_circling_fic_2000_28684.txt-238-10,4 Identical,"There is an isle, circled by southern seas, Far in a soft clime of perpetual spring, Where the voluptuous odor-laden || There is an isle, circled by southern seas, Far in a soft clime of perpetual spring, Where the voluptuous odor-laden"
circled_fic_1961_781980.txt-1331-7_circling_fic_2000_28684.txt-238-10,3 Closely Related 3 Closely Related 3 Closely Related,"They walked down the gravel path, circled the pool and fountain. || They walked down the gravel path, circled the pool and fountain. || They walked down the gravel path, circled the pool and fountain. || They walked down the gravel path, circled the pool and fountain. || They walked down the gravel path, circled the pool and fountain. || They walked down the gravel path, circled the pool and fountain."
circled_fic_1973_10568.txt-3728-22_circling_news_1964_724389.txt-48-3,3 Closely Related,"From a plane circling overhead, they looked like the expiring victim and the dismal survivor of a wrenching, thundering encounter in the night. "" || From a plane circling overhead, they looked like the expiring victim and the dismal survivor of a wrenching, thundering encounter in the night. """
circled_fic_1973_10568.txt-3728-22_circling_news_1964_724389.txt-48-3,3 Closely Related,"Somebody must be walking about down there in the bamboo and banana bushes, a tangle so thick that even the cats circled around it. || Somebody must be walking about down there in the bamboo and banana bushes, a tangle so thick that even the cats circled around it."
circled_fic_1979_10648.txt-6485-5_circling_fic_1993_1040082.txt-3463-10,3 Closely Related 3 Closely Related,"He was walking around the bed, quietly now, circling to the far wall. || He was walking around the bed, quietly now, circling to the far wall. || He was walking around the bed, quietly now, circling to the far wall. || He was walking around the bed, quietly now, circling to the far wall."
circled_fic_1985_10729.txt-5570-4_circling_fic_1999_44748.txt-709-16,3 Closely Related,"The jerking stiff-jointed puppets circled him, shuffling and bobbingp229along the floorboards. || The jerking stiff-jointed puppets circled him, shuffling and bobbingp229along the floorboards."
circled_fic_1985_10729.txt-5570-4_circling_fic_1999_44748.txt-709-16,3 Closely Related 4 Identical,I turn and watch Justin push his way in slow motion through the group of boys circling Liz and put his arm around her and toss his beer can away. || I turn and watch Justin push his way in slow motion through the group of boys circling Liz and put his arm around her and toss his beer can away. || I turn and watch Justin push his way in slow motion through the group of boys circling Liz and put his arm around her and toss his beer can away. || I turn and watch Justin push his way in slow motion through the group of boys circling Liz and put his arm around her and toss his beer can away.
circled_fic_1989_780083.txt-2098-19_circling_fic_1843_7039.txt-2109-16,3 Closely Related,"One day my attention was arrested by a very unusual twittering, and I saw him circling round with a large downy feather in his bill. || One day my attention was arrested by a very unusual twittering, and I saw him circling round with a large downy feather in his bill."
circled_fic_1989_780083.txt-2098-19_circling_fic_1843_7039.txt-2109-16,3 Closely Related 3 Closely Related,"As soon as he got there, a host of white flowers flew up from under his feet and circled above him anxiously like startled pigeons. || As soon as he got there, a host of white flowers flew up from under his feet and circled above him anxiously like startled pigeons. || As soon as he got there, a host of white flowers flew up from under his feet and circled above him anxiously like startled pigeons. || As soon as he got there, a host of white flowers flew up from under his feet and circled above him anxiously like startled pigeons."
circled_fic_1990_53210.txt-146-1_circling_fic_1974_10588.txt-478-28,3 Closely Related,"By the time Sam had give up and noticed what I was doing, I was a hundred yards off and going brisk, and the burro was circling off south of us both, his pack tree waggling. || By the time Sam had give up and noticed what I was doing, I was a hundred yards off and going brisk, and the burro was circling off south of us both, his pack tree waggling."
circled_fic_1990_53210.txt-146-1_circling_fic_1974_10588.txt-478-28,3 Closely Related,"He circled the car and touched it gently with the rubber tip of his cane, touched it several places, on a taillight, a hubcap, the front bumper, the name on the grill. "" || He circled the car and touched it gently with the rubber tip of his cane, touched it several places, on a taillight, a hubcap, the front bumper, the name on the grill. """
circled_fic_2000_32016.txt-215-2_circle_mag_2001_371787.txt-17-9,2 Distantly Related,"With no enemy anti-aircraft fire, U.S. spy planes circle the sky, daring al-Qaeda fighters to step out of their caves and become glowing infrared targets. || With no enemy anti-aircraft fire, U.S. spy planes circle the sky, daring al-Qaeda fighters to step out of their caves and become glowing infrared targets."
circled_fic_2000_32016.txt-215-2_circled_fic_1979_10648.txt-6485-5,2 Distantly Related 2 Distantly Related,Must have circled back when he wasn't looking. || Must have circled back when he wasn't looking. || Must have circled back when he wasn't looking. || Must have circled back when he wasn't looking.
circled_fic_2000_32016.txt-215-2_circled_fic_1979_10648.txt-6485-5,2 Distantly Related 3 Closely Related,Like the Russian astronauts who circled the earth and did not see God. || Like the Russian astronauts who circled the earth and did not see God. || Like the Russian astronauts who circled the earth and did not see God. || Like the Russian astronauts who circled the earth and did not see God.
circled_fic_2003_32292.txt-187-15_circling_mag_1973_280788.txt-28-1,4 Identical 2 Distantly Related 3 Closely Related,"While circling over Algeria's Blida Airport in anticipation of De Gaulle's departure, the pilot was dismayed to see that a swarm of helicopters had taken off at once. || While circling over Algeria's Blida Airport in anticipation of De Gaulle's departure, the pilot was dismayed to see that a swarm of helicopters had taken off at once. || While circling over Algeria's Blida Airport in anticipation of De Gaulle's departure, the pilot was dismayed to see that a swarm of helicopters had taken off at once. || While circling over Algeria's Blida Airport in anticipation of De Gaulle's departure, the pilot was dismayed to see that a swarm of helicopters had taken off at once. || While circling over Algeria's Blida Airport in anticipation of De Gaulle's departure, the pilot was dismayed to see that a swarm of helicopters had taken off at once. || While circling over Algeria's Blida Airport in anticipation of De Gaulle's departure, the pilot was dismayed to see that a swarm of helicopters had taken off at once."
circled_fic_2003_32292.txt-187-15_circling_mag_1973_280788.txt-28-1,4 Identical 3 Closely Related,"It showed the live feed from the cockpit of one of the fighter-bombers as it circled high above Petra, broadcast around the world via the Global Community News Network. || It showed the live feed from the cockpit of one of the fighter-bombers as it circled high above Petra, broadcast around the world via the Global Community News Network. || It showed the live feed from the cockpit of one of the fighter-bombers as it circled high above Petra, broadcast around the world via the Global Community News Network. || It showed the live feed from the cockpit of one of the fighter-bombers as it circled high above Petra, broadcast around the world via the Global Community News Network."
circled_mag_1977_431937.txt-45-14_circled_fic_1993_1040095.txt-1060-4,3 Closely Related,"His captor began to pace the floor chain-smoking, holding the rope which still circled Todd's waist. || His captor began to pace the floor chain-smoking, holding the rope which still circled Todd's waist."
circled_news_1962_722823.txt-13-1_circled_fic_1980_782023.txt-2137-4,2 Distantly Related 3 Closely Related,"No matter what problems circled, prowling and growling, around him, North never put down his whip and chair, invisible though they might be, and once he began directing, every person on the set was convinced that || No matter what problems circled, prowling and growling, around him, North never put down his whip and chair, invisible though they might be, and once he began directing, every person on the set was convinced that || No matter what problems circled, prowling and growling, around him, North never put down his whip and chair, invisible though they might be, and once he began directing, every person on the set was convinced that || No matter what problems circled, prowling and growling, around him, North never put down his whip and chair, invisible though they might be, and once he began directing, every person on the set was convinced that"
circled_news_1962_722823.txt-13-1_circled_fic_1980_782023.txt-2137-4,2 Distantly Related 3 Closely Related,Scannell circled the big black car warily and confirmed that it was the governor's. || Scannell circled the big black car warily and confirmed that it was the governor's. || Scannell circled the big black car warily and confirmed that it was the governor's. || Scannell circled the big black car warily and confirmed that it was the governor's.
circling_fic_1827_9759.txt-3987-31_circle_nf_2001_776374.txt-73-15,2 Distantly Related,"-- Let me, while the sun lingers, still pour out my soul on this paper -- Let me indulge a pleasing, dreadful thought -- Shall I, ere circling time bring back this hour, become thy -- And shall my heart, after its dreadful languors, its excruciating agonies, know once more, a rapturous emotion? || -- Let me, while the sun lingers, still pour out my soul on this paper -- Let me indulge a pleasing, dreadful thought -- Shall I, ere circling time bring back this hour, become thy -- And shall my heart, after its dreadful languors, its excruciating agonies, know once more, a rapturous emotion?"
circling_fic_1831_8376.txt-519-19_circled_fic_1977_780102.txt-3228-22,2 Distantly Related,"They were easily distinguished from the women of the desert region near Hijaneh who wore bright yellows and pinks, their foreheads circled by a series of gold discs. || They were easily distinguished from the women of the desert region near Hijaneh who wore bright yellows and pinks, their foreheads circled by a series of gold discs."
circling_fic_1831_8376.txt-519-19_circled_fic_1977_780102.txt-3228-22,2 Distantly Related,"whose doors we now For social worship first unfold, To thee the suppliant throng shall bow, While circling years on years are rolled. || whose doors we now For social worship first unfold, To thee the suppliant throng shall bow, While circling years on years are rolled."
circling_fic_1833_7059.txt-374-11_circling_fic_1978_10634.txt-2489-8,0 Undecidable,"There were also two or three bacchanalian songs, concerning "" circling cups "" and "" rosy wine, "" (he always drank cinnamon cordial diluted with water,) &c.; &c.; At the time of receiving this, I was busy with "" an essay attempting to form a judgment of the characters of authors from their works. "" || There were also two or three bacchanalian songs, concerning "" circling cups "" and "" rosy wine, "" (he always drank cinnamon cordial diluted with water,) &c.; &c.; At the time of receiving this, I was busy with "" an essay attempting to form a judgment of the characters of authors from their works. """
circling_fic_1840_8909.txt-155-63_circle_nf_1827_747521.txt-163-33,2 Distantly Related,"Brief not thy course at that either, for thou hast often seen the son of clouded prospect, leap to the highest seat that power yields, carry thine eye unsealed and wary to scan mankind, for it will be a convoy for thy relief: let not the glib and stealthy tongued prater, with his o'erfull breast of friendship circling nothing, spear thy heart to that condition, || Brief not thy course at that either, for thou hast often seen the son of clouded prospect, leap to the highest seat that power yields, carry thine eye unsealed and wary to scan mankind, for it will be a convoy for thy relief: let not the glib and stealthy tongued prater, with his o'erfull breast of friendship circling nothing, spear thy heart to that condition,"
circling_fic_1840_8909.txt-155-63_circle_nf_1827_747521.txt-163-33,2 Distantly Related,"Let 6/, be the central hne; divide it into four parts, and at one fourth make the hne a b across the column; on c, make the half circle a e b; with the distance / 1, at the neck of the column, and on 1, on the central hne, make the points 1, 1, on the circle; divide from 1 to c, || Let 6/, be the central hne; divide it into four parts, and at one fourth make the hne a b across the column; on c, make the half circle a e b; with the distance / 1, at the neck of the column, and on 1, on the central hne, make the points 1, 1, on the circle; divide from 1 to c,"
circling_fic_1849_2605.txt-1633-35_circling_fic_1854_70.txt-2012-8,4 Identical,"If any one besides his master went into the field and tried to catch Ned, he was sure to have a troublesome time of it; and if he succeeded in his object before circling the field a dozen times in pursuit of the horse, he might think himself lucky. || If any one besides his master went into the field and tried to catch Ned, he was sure to have a troublesome time of it; and if he succeeded in his object before circling the field a dozen times in pursuit of the horse, he might think himself lucky."
circling_fic_1849_2605.txt-1633-35_circling_fic_1854_70.txt-2012-8,4 Identical,"Or sometimes I watched a pair of hen-hawks circling high in the sky, alternately soaring and descending, approaching, and leaving one another, as if they were the embodiment of my own thoughts. || Or sometimes I watched a pair of hen-hawks circling high in the sky, alternately soaring and descending, approaching, and leaving one another, as if they were the embodiment of my own thoughts."
circling_fic_1854_8328.txt-1757-74_circle_mag_1992_409433.txt-83-9,4 Identical 2 Distantly Related,"Once out of sight, the buck angled to circle around me. || Once out of sight, the buck angled to circle around me. || Once out of sight, the buck angled to circle around me. || Once out of sight, the buck angled to circle around me."
circling_fic_1854_8328.txt-1757-74_circle_mag_1992_409433.txt-83-9,4 Identical 3 Closely Related,"Turrets tremble with pealing bells -- Joy loudly winds his bugle horn, And the heart of a nation proudly swells When an heir to royalty is born; But, greeted by a strain more wild, Leaps from its fount the mountain-child: Old piny groves a mellow roar From their mysterious depths outpour Commingled with the panther's scream -- Murmur of torrents, and the cry Of the gray eagle circling high -- Meet welcome for a stream That dashes down, in youthful force, From the green hills to run its course. || Turrets tremble with pealing bells -- Joy loudly winds his bugle horn, And the heart of a nation proudly swells When an heir to royalty is born; But, greeted by a strain more wild, Leaps from its fount the mountain-child: Old piny groves a mellow roar From their mysterious depths outpour Commingled with the panther's scream -- Murmur of torrents, and the cry Of the gray eagle circling high -- Meet welcome for a stream That dashes down, in youthful force, From the green hills to run its course. || Turrets tremble with pealing bells -- Joy loudly winds his bugle horn, And the heart of a nation proudly swells When an heir to royalty is born; But, greeted by a strain more wild, Leaps from its fount the mountain-child: Old piny groves a mellow roar From their mysterious depths outpour Commingled with the panther's scream -- Murmur of torrents, and the cry Of the gray eagle circling high -- Meet welcome for a stream That dashes down, in youthful force, From the green hills to run its course. || Turrets tremble with pealing bells -- Joy loudly winds his bugle horn, And the heart of a nation proudly swells When an heir to royalty is born; But, greeted by a strain more wild, Leaps from its fount the mountain-child: Old piny groves a mellow roar From their mysterious depths outpour Commingled with the panther's scream -- Murmur of torrents, and the cry Of the gray eagle circling high -- Meet welcome for a stream That dashes down, in youthful force, From the green hills to run its course."
circling_fic_1855_9053.txt-8774-39_circling_fic_1838_7250.txt-2477-27,3 Closely Related,"At the catastrophe, Mrs. Gambril ceased her flight, but after the manner of the Cossacks of the Don, or the Mahratta cavalry, kept circling round the enemy -- out of striking distance, yet within hail. "" || At the catastrophe, Mrs. Gambril ceased her flight, but after the manner of the Cossacks of the Don, or the Mahratta cavalry, kept circling round the enemy -- out of striking distance, yet within hail. """
circling_fic_1855_9053.txt-8774-39_circling_fic_1838_7250.txt-2477-27,3 Closely Related,"He laughed so gleefully upon the shifting weather-cocks, and on the tall, white, crimson-flooded spires, which pointed up to heaven -- and on the wings of snowy pigeons, cutting the blue air, and circling joyously -- and on the little maiden, tripping on along the street, toward school, and laughing merrily || He laughed so gleefully upon the shifting weather-cocks, and on the tall, white, crimson-flooded spires, which pointed up to heaven -- and on the wings of snowy pigeons, cutting the blue air, and circling joyously -- and on the little maiden, tripping on along the street, toward school, and laughing merrily"
circling_fic_1978_10634.txt-2489-8_Circling_fic_1848_7992.txt-315-50,2 Distantly Related 0 Undecidable,"Otis and Brady approached each other similarly; circling in small, glidingsteps, each moving opposite his opponent's crooked left arm, each one's left elbow down in front of his left ribs, each one's left hand extendedshoulder-high a foot, each one's right hand cocked back below his right cheek ready to attack or defend. || Otis and Brady approached each other similarly; circling in small, glidingsteps, each moving opposite his opponent's crooked left arm, each one's left elbow down in front of his left ribs, each one's left hand extendedshoulder-high a foot, each one's right hand cocked back below his right cheek ready to attack or defend. || Otis and Brady approached each other similarly; circling in small, glidingsteps, each moving opposite his opponent's crooked left arm, each one's left elbow down in front of his left ribs, each one's left hand extendedshoulder-high a foot, each one's right hand cocked back below his right cheek ready to attack or defend. || Otis and Brady approached each other similarly; circling in small, glidingsteps, each moving opposite his opponent's crooked left arm, each one's left elbow down in front of his left ribs, each one's left hand extendedshoulder-high a foot, each one's right hand cocked back below his right cheek ready to attack or defend."
circling_fic_1978_10634.txt-2489-8_Circling_fic_1848_7992.txt-315-50,2 Distantly Related 2 Distantly Related,"As the rivers, farthest flowing, In the highest hills have birth; As the banyan, broadest growing, Oftenest bows its head to earth, -- So the noblest minds press onward, Channels far of good to trace; So the largest hearts bend downward, Circling all the human race; Thus, by Iron's aid, pursuing Through the earth their plans of love, Men our Father's will are doing, Here, as angels do above! || As the rivers, farthest flowing, In the highest hills have birth; As the banyan, broadest growing, Oftenest bows its head to earth, -- So the noblest minds press onward, Channels far of good to trace; So the largest hearts bend downward, Circling all the human race; Thus, by Iron's aid, pursuing Through the earth their plans of love, Men our Father's will are doing, Here, as angels do above! || As the rivers, farthest flowing, In the highest hills have birth; As the banyan, broadest growing, Oftenest bows its head to earth, -- So the noblest minds press onward, Channels far of good to trace; So the largest hearts bend downward, Circling all the human race; Thus, by Iron's aid, pursuing Through the earth their plans of love, Men our Father's will are doing, Here, as angels do above! || As the rivers, farthest flowing, In the highest hills have birth; As the banyan, broadest growing, Oftenest bows its head to earth, -- So the noblest minds press onward, Channels far of good to trace; So the largest hearts bend downward, Circling all the human race; Thus, by Iron's aid, pursuing Through the earth their plans of love, Men our Father's will are doing, Here, as angels do above!"
circling_fic_1984_780041.txt-3391-5_circled_fic_2003_31844.txt-29-3,4 Identical,"He had already circled our block about ten times in a row and each time he got a little closer to the house, as if he were zeroing in on a target. || He had already circled our block about ten times in a row and each time he got a little closer to the house, as if he were zeroing in on a target."
circling_fic_1994_54062.txt-687-3_circle_fic_1966_23837.txt-437-2,2 Distantly Related 2 Distantly Related,"Roy would circle and circle looking in vain for his opening, and then -- it never failed to happen -- Julian would cock back his right arm, cry "" Ya! || Roy would circle and circle looking in vain for his opening, and then -- it never failed to happen -- Julian would cock back his right arm, cry "" Ya! || Roy would circle and circle looking in vain for his opening, and then -- it never failed to happen -- Julian would cock back his right arm, cry "" Ya! || Roy would circle and circle looking in vain for his opening, and then -- it never failed to happen -- Julian would cock back his right arm, cry "" Ya!"
circling_fic_1994_54062.txt-687-3_circling_fic_2000_28684.txt-238-10,3 Closely Related 2 Distantly Related,"More Gothas were circling above and below, propellers churning through the murk, their familiar Wong-wong filling the fog. || More Gothas were circling above and below, propellers churning through the murk, their familiar Wong-wong filling the fog. || More Gothas were circling above and below, propellers churning through the murk, their familiar Wong-wong filling the fog. || More Gothas were circling above and below, propellers churning through the murk, their familiar Wong-wong filling the fog."
circling_fic_1994_54062.txt-687-3_circling_fic_2000_28684.txt-238-10,3 Closely Related 3 Closely Related 3 Closely Related 4 Identical 3 Closely Related,"had to wade through weaving bodies and waving tails, circling him, doubling back, rubbing his ankles, and getting under his feet-all the while yowling in the operatic voices of Siamese. || had to wade through weaving bodies and waving tails, circling him, doubling back, rubbing his ankles, and getting under his feet-all the while yowling in the operatic voices of Siamese. || had to wade through weaving bodies and waving tails, circling him, doubling back, rubbing his ankles, and getting under his feet-all the while yowling in the operatic voices of Siamese. || had to wade through weaving bodies and waving tails, circling him, doubling back, rubbing his ankles, and getting under his feet-all the while yowling in the operatic voices of Siamese. || had to wade through weaving bodies and waving tails, circling him, doubling back, rubbing his ankles, and getting under his feet-all the while yowling in the operatic voices of Siamese. || had to wade through weaving bodies and waving tails, circling him, doubling back, rubbing his ankles, and getting under his feet-all the while yowling in the operatic voices of Siamese. || had to wade through weaving bodies and waving tails, circling him, doubling back, rubbing his ankles, and getting under his feet-all the while yowling in the operatic voices of Siamese. || had to wade through weaving bodies and waving tails, circling him, doubling back, rubbing his ankles, and getting under his feet-all the while yowling in the operatic voices of Siamese. || had to wade through weaving bodies and waving tails, circling him, doubling back, rubbing his ankles, and getting under his feet-all the while yowling in the operatic voices of Siamese. || had to wade through weaving bodies and waving tails, circling him, doubling back, rubbing his ankles, and getting under his feet-all the while yowling in the operatic voices of Siamese."
circling_fic_1999_44748.txt-709-16_circling_fic_1846_7036.txt-2560-11,4 Identical,"They were not aware that the spirit of a nightingale was circling round them and would pass into the soul of their infant son, whom they named Felix Mendelssohn. || They were not aware that the spirit of a nightingale was circling round them and would pass into the soul of their infant son, whom they named Felix Mendelssohn."
