annotation_lbl,categories,sentences
pin_news_1974_731358.txt-31-11_pinned_fic_1825_7041.txt-1698-26,2 Distantly Related 2 Distantly Related 2 Distantly Related 3 Closely Related 3 Closely Related 2 Distantly Related,"Other sources said the investigators plan to call witnesses who can pin down the date and details of the "" hush money "" payment to H, Howard Hunt on March 21, 1973, including a "" mystery man "" who helped the special prosecutor establish the date. || Other sources said the investigators plan to call witnesses who can pin down the date and details of the "" hush money "" payment to H, Howard Hunt on March 21, 1973, including a "" mystery man "" who helped the special prosecutor establish the date. || Other sources said the investigators plan to call witnesses who can pin down the date and details of the "" hush money "" payment to H, Howard Hunt on March 21, 1973, including a "" mystery man "" who helped the special prosecutor establish the date. || Other sources said the investigators plan to call witnesses who can pin down the date and details of the "" hush money "" payment to H, Howard Hunt on March 21, 1973, including a "" mystery man "" who helped the special prosecutor establish the date. || Other sources said the investigators plan to call witnesses who can pin down the date and details of the "" hush money "" payment to H, Howard Hunt on March 21, 1973, including a "" mystery man "" who helped the special prosecutor establish the date. || Other sources said the investigators plan to call witnesses who can pin down the date and details of the "" hush money "" payment to H, Howard Hunt on March 21, 1973, including a "" mystery man "" who helped the special prosecutor establish the date. || Other sources said the investigators plan to call witnesses who can pin down the date and details of the "" hush money "" payment to H, Howard Hunt on March 21, 1973, including a "" mystery man "" who helped the special prosecutor establish the date. || Other sources said the investigators plan to call witnesses who can pin down the date and details of the "" hush money "" payment to H, Howard Hunt on March 21, 1973, including a "" mystery man "" who helped the special prosecutor establish the date. || Other sources said the investigators plan to call witnesses who can pin down the date and details of the "" hush money "" payment to H, Howard Hunt on March 21, 1973, including a "" mystery man "" who helped the special prosecutor establish the date. || Other sources said the investigators plan to call witnesses who can pin down the date and details of the "" hush money "" payment to H, Howard Hunt on March 21, 1973, including a "" mystery man "" who helped the special prosecutor establish the date. || Other sources said the investigators plan to call witnesses who can pin down the date and details of the "" hush money "" payment to H, Howard Hunt on March 21, 1973, including a "" mystery man "" who helped the special prosecutor establish the date. || Other sources said the investigators plan to call witnesses who can pin down the date and details of the "" hush money "" payment to H, Howard Hunt on March 21, 1973, including a "" mystery man "" who helped the special prosecutor establish the date."
pinned_fic_1825_7041.txt-1698-26_pinning_mag_1967_272727.txt-13-11,2 Distantly Related 2 Distantly Related 2 Distantly Related,"Grace soon arranged her neat little gipsey hat, beneath which her golden ringlets escaped in the most enchanting luxuriance; and the shawl was just pinned about her neck with Quaker simplicity, when Somerville entered. "" || Grace soon arranged her neat little gipsey hat, beneath which her golden ringlets escaped in the most enchanting luxuriance; and the shawl was just pinned about her neck with Quaker simplicity, when Somerville entered. "" || Grace soon arranged her neat little gipsey hat, beneath which her golden ringlets escaped in the most enchanting luxuriance; and the shawl was just pinned about her neck with Quaker simplicity, when Somerville entered. "" || Grace soon arranged her neat little gipsey hat, beneath which her golden ringlets escaped in the most enchanting luxuriance; and the shawl was just pinned about her neck with Quaker simplicity, when Somerville entered. "" || Grace soon arranged her neat little gipsey hat, beneath which her golden ringlets escaped in the most enchanting luxuriance; and the shawl was just pinned about her neck with Quaker simplicity, when Somerville entered. "" || Grace soon arranged her neat little gipsey hat, beneath which her golden ringlets escaped in the most enchanting luxuriance; and the shawl was just pinned about her neck with Quaker simplicity, when Somerville entered. """
pinned_fic_1839_7024.txt-2238-13_pin_mag_1968_478849.txt-47-13,2 Distantly Related,", and it was buttoned close up to his throat, or rather pinned up, for the top buttons were all gone; his gloves were ragged, and his boots were heel-less; his cap, as usual, was drawn very much over his eyes. "" || , and it was buttoned close up to his throat, or rather pinned up, for the top buttons were all gone; his gloves were ragged, and his boots were heel-less; his cap, as usual, was drawn very much over his eyes. """
pinned_fic_1843_7208.txt-1264-13_pinned_fic_1984_10714.txt-3436-9,4 Identical,"The articles forming an entire and complete suit, were luckily found carefully pinned together, and this rendered the task comparatively easy and brief. || The articles forming an entire and complete suit, were luckily found carefully pinned together, and this rendered the task comparatively easy and brief."
pinned_fic_1843_7208.txt-1264-13_pinned_fic_1984_10714.txt-3436-9,4 Identical,"To the pocket of his white turtleneck sweater was pinned a rectangular nameplate of the sort worn by soldiers: SINGER. "" || To the pocket of his white turtleneck sweater was pinned a rectangular nameplate of the sort worn by soldiers: SINGER. """
pinned_fic_1845_7162.txt-2310-51_pinned_fic_1994_54077.txt-587-7,3 Closely Related,"Full at this opening the wolf dashed, as fresh, Tom said, as though he had not run a yard; but as he struggled through it, his efforts shook the top rails from the yokes, and the huge piece of timber falling across his loins, pinned him completely! || Full at this opening the wolf dashed, as fresh, Tom said, as though he had not run a yard; but as he struggled through it, his efforts shook the top rails from the yokes, and the huge piece of timber falling across his loins, pinned him completely!"
pinned_fic_1845_7162.txt-2310-51_pinned_fic_1994_54077.txt-587-7,3 Closely Related 2 Distantly Related 2 Distantly Related 2 Distantly Related 3 Closely Related,"I pinned Thalia down as I had pinned Charles, grasping her face with both hands, and where my fingers pressed her temples the skin was pouring into soft folds, spilling over her hair. || I pinned Thalia down as I had pinned Charles, grasping her face with both hands, and where my fingers pressed her temples the skin was pouring into soft folds, spilling over her hair. || I pinned Thalia down as I had pinned Charles, grasping her face with both hands, and where my fingers pressed her temples the skin was pouring into soft folds, spilling over her hair. || I pinned Thalia down as I had pinned Charles, grasping her face with both hands, and where my fingers pressed her temples the skin was pouring into soft folds, spilling over her hair. || I pinned Thalia down as I had pinned Charles, grasping her face with both hands, and where my fingers pressed her temples the skin was pouring into soft folds, spilling over her hair. || I pinned Thalia down as I had pinned Charles, grasping her face with both hands, and where my fingers pressed her temples the skin was pouring into soft folds, spilling over her hair. || I pinned Thalia down as I had pinned Charles, grasping her face with both hands, and where my fingers pressed her temples the skin was pouring into soft folds, spilling over her hair. || I pinned Thalia down as I had pinned Charles, grasping her face with both hands, and where my fingers pressed her temples the skin was pouring into soft folds, spilling over her hair. || I pinned Thalia down as I had pinned Charles, grasping her face with both hands, and where my fingers pressed her temples the skin was pouring into soft folds, spilling over her hair. || I pinned Thalia down as I had pinned Charles, grasping her face with both hands, and where my fingers pressed her temples the skin was pouring into soft folds, spilling over her hair."
pinned_fic_1849_7167.txt-2664-4_pinning_fic_1971_782006.txt-2087-5,2 Distantly Related,"We observed a ticket pinned to the cushion, with the || We observed a ticket pinned to the cushion, with the"
pinned_fic_1851_746.txt-4622-94_pinned_fic_1825_7041.txt-1698-26,2 Distantly Related,"Until Cabaco's published discovery, the sailors had little foreseen it, though to be sure when, after being a little while out of port, all hands had concluded the customary business of fitting the whaleboats for service; when some time after this Ahab was now and then found bestirring himself in the matter of making thole-pins with his own hands for what was thought to be one of the spare boats, and even solicitously cutting the small wooden skewers, which when the line is running out are pinned over the groove in the bow: when all this was observed in him, and particularly his solicitude in having an extra coat of sheathing in the bottom || Until Cabaco's published discovery, the sailors had little foreseen it, though to be sure when, after being a little while out of port, all hands had concluded the customary business of fitting the whaleboats for service; when some time after this Ahab was now and then found bestirring himself in the matter of making thole-pins with his own hands for what was thought to be one of the spare boats, and even solicitously cutting the small wooden skewers, which when the line is running out are pinned over the groove in the bow: when all this was observed in him, and particularly his solicitude in having an extra coat of sheathing in the bottom"
pinned_fic_1854_3384.txt-477-11_pinned_fic_1994_54077.txt-587-7,2 Distantly Related 2 Distantly Related 2 Distantly Related,"Carefully covering him with the thin, tattered blankets, she pinned a shawl over her head, and, softly closing the door behind her, stole forth into the biting night air, and directed a hasty tread toward Mr. Pimble's great brick mansion. || Carefully covering him with the thin, tattered blankets, she pinned a shawl over her head, and, softly closing the door behind her, stole forth into the biting night air, and directed a hasty tread toward Mr. Pimble's great brick mansion. || Carefully covering him with the thin, tattered blankets, she pinned a shawl over her head, and, softly closing the door behind her, stole forth into the biting night air, and directed a hasty tread toward Mr. Pimble's great brick mansion. || Carefully covering him with the thin, tattered blankets, she pinned a shawl over her head, and, softly closing the door behind her, stole forth into the biting night air, and directed a hasty tread toward Mr. Pimble's great brick mansion. || Carefully covering him with the thin, tattered blankets, she pinned a shawl over her head, and, softly closing the door behind her, stole forth into the biting night air, and directed a hasty tread toward Mr. Pimble's great brick mansion. || Carefully covering him with the thin, tattered blankets, she pinned a shawl over her head, and, softly closing the door behind her, stole forth into the biting night air, and directed a hasty tread toward Mr. Pimble's great brick mansion."
pinned_fic_1856_1281.txt-4925-41_pin_mag_1995_394841.txt-66-9,2 Distantly Related 3 Closely Related 3 Closely Related,The new data on these stars have helped astronomers pin down just where these stars are in their evolution. || The new data on these stars have helped astronomers pin down just where these stars are in their evolution. || The new data on these stars have helped astronomers pin down just where these stars are in their evolution. || The new data on these stars have helped astronomers pin down just where these stars are in their evolution. || The new data on these stars have helped astronomers pin down just where these stars are in their evolution. || The new data on these stars have helped astronomers pin down just where these stars are in their evolution.
pinned_fic_1856_9852.txt-1992-15_pin_fic_1965_780079.txt-2466-36,2 Distantly Related 2 Distantly Related 2 Distantly Related,"The figure of the old negro was low and stooping; and he wore, pinned round his shoulders, a half-handkerchief or shawl of red flannel, arranged much as an old woman would have arranged it. || The figure of the old negro was low and stooping; and he wore, pinned round his shoulders, a half-handkerchief or shawl of red flannel, arranged much as an old woman would have arranged it. || The figure of the old negro was low and stooping; and he wore, pinned round his shoulders, a half-handkerchief or shawl of red flannel, arranged much as an old woman would have arranged it. || The figure of the old negro was low and stooping; and he wore, pinned round his shoulders, a half-handkerchief or shawl of red flannel, arranged much as an old woman would have arranged it. || The figure of the old negro was low and stooping; and he wore, pinned round his shoulders, a half-handkerchief or shawl of red flannel, arranged much as an old woman would have arranged it. || The figure of the old negro was low and stooping; and he wore, pinned round his shoulders, a half-handkerchief or shawl of red flannel, arranged much as an old woman would have arranged it."
pinned_fic_1856_9852.txt-1992-15_pin_fic_1965_780079.txt-2466-36,2 Distantly Related 3 Closely Related 2 Distantly Related,"He cut a sapling and carved a spear point, long and white; confronting the wolf, he drove the raw white wood into its chest as it came up at him and fought to pin it to the ground and grind the pain out of it. || He cut a sapling and carved a spear point, long and white; confronting the wolf, he drove the raw white wood into its chest as it came up at him and fought to pin it to the ground and grind the pain out of it. || He cut a sapling and carved a spear point, long and white; confronting the wolf, he drove the raw white wood into its chest as it came up at him and fought to pin it to the ground and grind the pain out of it. || He cut a sapling and carved a spear point, long and white; confronting the wolf, he drove the raw white wood into its chest as it came up at him and fought to pin it to the ground and grind the pain out of it. || He cut a sapling and carved a spear point, long and white; confronting the wolf, he drove the raw white wood into its chest as it came up at him and fought to pin it to the ground and grind the pain out of it. || He cut a sapling and carved a spear point, long and white; confronting the wolf, he drove the raw white wood into its chest as it came up at him and fought to pin it to the ground and grind the pain out of it."
pinned_fic_1856_9852.txt-1992-15_pinned_fic_2005_780525.txt-1247-12,2 Distantly Related,The cars are so close to Talley that his own vehicle is pinned; he couldn't drive away now even if he wanted -- INT. || The cars are so close to Talley that his own vehicle is pinned; he couldn't drive away now even if he wanted -- INT.
pinned_fic_1858_9768.txt-4185-16_pin_nf_1994_746848.txt-3-22,2 Distantly Related,"The MST's measurement of Cepheids in the Virgo cluster was to be the opening salvo in an assault that would soon pin down this fundamental parameter of cosmology to within 10%, once and for all. || The MST's measurement of Cepheids in the Virgo cluster was to be the opening salvo in an assault that would soon pin down this fundamental parameter of cosmology to within 10%, once and for all."
pinned_fic_1963_10432.txt-3514-3_pin_fic_1855_2416.txt-209-5,2 Distantly Related 2 Distantly Related 2 Distantly Related,"When Penny, pinned off balance, repeats "" Please, "" the honest fear in her voice gives him an excuse to relent. || When Penny, pinned off balance, repeats "" Please, "" the honest fear in her voice gives him an excuse to relent. || When Penny, pinned off balance, repeats "" Please, "" the honest fear in her voice gives him an excuse to relent. || When Penny, pinned off balance, repeats "" Please, "" the honest fear in her voice gives him an excuse to relent. || When Penny, pinned off balance, repeats "" Please, "" the honest fear in her voice gives him an excuse to relent. || When Penny, pinned off balance, repeats "" Please, "" the honest fear in her voice gives him an excuse to relent."
pinned_fic_1963_10432.txt-3514-3_pin_fic_1855_2416.txt-209-5,2 Distantly Related 4 Identical 1 Unrelated 2 Distantly Related 3 Closely Related,"Each was disposed to "" pin his faith "" upon others. || Each was disposed to "" pin his faith "" upon others. || Each was disposed to "" pin his faith "" upon others. || Each was disposed to "" pin his faith "" upon others. || Each was disposed to "" pin his faith "" upon others. || Each was disposed to "" pin his faith "" upon others. || Each was disposed to "" pin his faith "" upon others. || Each was disposed to "" pin his faith "" upon others. || Each was disposed to "" pin his faith "" upon others. || Each was disposed to "" pin his faith "" upon others."
pinned_fic_1963_10432.txt-3514-3_pinning_fic_1826_314.txt-1912-21,2 Distantly Related,"Unable longer to foil an enemy so alert and vigilant, he threw his arms about him, and succeeded in pinning the limbs of the other to his side, with an iron grasp, but one that was far too exhausting to himself to continue long. || Unable longer to foil an enemy so alert and vigilant, he threw his arms about him, and succeeded in pinning the limbs of the other to his side, with an iron grasp, but one that was far too exhausting to himself to continue long."
pinned_fic_1966_1008.txt-2519-23_pinning_fic_1971_782006.txt-2087-5,2 Distantly Related 2 Distantly Related 3 Closely Related 2 Distantly Related,"A door was opened, pinning her against the stone wall, and a voice said, "" Get in, Mrs. Pollifax. "" || A door was opened, pinning her against the stone wall, and a voice said, "" Get in, Mrs. Pollifax. "" || A door was opened, pinning her against the stone wall, and a voice said, "" Get in, Mrs. Pollifax. "" || A door was opened, pinning her against the stone wall, and a voice said, "" Get in, Mrs. Pollifax. "" || A door was opened, pinning her against the stone wall, and a voice said, "" Get in, Mrs. Pollifax. "" || A door was opened, pinning her against the stone wall, and a voice said, "" Get in, Mrs. Pollifax. "" || A door was opened, pinning her against the stone wall, and a voice said, "" Get in, Mrs. Pollifax. "" || A door was opened, pinning her against the stone wall, and a voice said, "" Get in, Mrs. Pollifax. """
pinned_fic_1966_1008.txt-2519-23_pinning_fic_1971_782006.txt-2087-5,2 Distantly Related 2 Distantly Related 3 Closely Related 2 Distantly Related 2 Distantly Related,"lonely room at night, he held the lamp up to a bit of poetry that he had cut from a magazine and pinned to the looking-glass. || lonely room at night, he held the lamp up to a bit of poetry that he had cut from a magazine and pinned to the looking-glass. || lonely room at night, he held the lamp up to a bit of poetry that he had cut from a magazine and pinned to the looking-glass. || lonely room at night, he held the lamp up to a bit of poetry that he had cut from a magazine and pinned to the looking-glass. || lonely room at night, he held the lamp up to a bit of poetry that he had cut from a magazine and pinned to the looking-glass. || lonely room at night, he held the lamp up to a bit of poetry that he had cut from a magazine and pinned to the looking-glass. || lonely room at night, he held the lamp up to a bit of poetry that he had cut from a magazine and pinned to the looking-glass. || lonely room at night, he held the lamp up to a bit of poetry that he had cut from a magazine and pinned to the looking-glass. || lonely room at night, he held the lamp up to a bit of poetry that he had cut from a magazine and pinned to the looking-glass. || lonely room at night, he held the lamp up to a bit of poetry that he had cut from a magazine and pinned to the looking-glass."
pinned_fic_1970_10535.txt-192-2_pinned_fic_1963_10432.txt-3514-3,2 Distantly Related 2 Distantly Related 4 Identical 3 Closely Related 3 Closely Related,"Circular decals pinned to their waists announced them as Maxine, Victoria and Inez -- waitTHEELECTRIC COTILLION 29resses, not apparitions; their bare shoulders smelled of jasmine, and gorgeously colored plumes rose from their heads. "" || Circular decals pinned to their waists announced them as Maxine, Victoria and Inez -- waitTHEELECTRIC COTILLION 29resses, not apparitions; their bare shoulders smelled of jasmine, and gorgeously colored plumes rose from their heads. "" || Circular decals pinned to their waists announced them as Maxine, Victoria and Inez -- waitTHEELECTRIC COTILLION 29resses, not apparitions; their bare shoulders smelled of jasmine, and gorgeously colored plumes rose from their heads. "" || Circular decals pinned to their waists announced them as Maxine, Victoria and Inez -- waitTHEELECTRIC COTILLION 29resses, not apparitions; their bare shoulders smelled of jasmine, and gorgeously colored plumes rose from their heads. "" || Circular decals pinned to their waists announced them as Maxine, Victoria and Inez -- waitTHEELECTRIC COTILLION 29resses, not apparitions; their bare shoulders smelled of jasmine, and gorgeously colored plumes rose from their heads. "" || Circular decals pinned to their waists announced them as Maxine, Victoria and Inez -- waitTHEELECTRIC COTILLION 29resses, not apparitions; their bare shoulders smelled of jasmine, and gorgeously colored plumes rose from their heads. "" || Circular decals pinned to their waists announced them as Maxine, Victoria and Inez -- waitTHEELECTRIC COTILLION 29resses, not apparitions; their bare shoulders smelled of jasmine, and gorgeously colored plumes rose from their heads. "" || Circular decals pinned to their waists announced them as Maxine, Victoria and Inez -- waitTHEELECTRIC COTILLION 29resses, not apparitions; their bare shoulders smelled of jasmine, and gorgeously colored plumes rose from their heads. "" || Circular decals pinned to their waists announced them as Maxine, Victoria and Inez -- waitTHEELECTRIC COTILLION 29resses, not apparitions; their bare shoulders smelled of jasmine, and gorgeously colored plumes rose from their heads. "" || Circular decals pinned to their waists announced them as Maxine, Victoria and Inez -- waitTHEELECTRIC COTILLION 29resses, not apparitions; their bare shoulders smelled of jasmine, and gorgeously colored plumes rose from their heads. """
pinned_fic_1970_10535.txt-192-2_pinned_fic_1983_10707.txt-5476-10,3 Closely Related,Though it would finally be left in this fashion -- pinned back from her face with carved pieces of bone || Though it would finally be left in this fashion -- pinned back from her face with carved pieces of bone
pinned_fic_1976_780103.txt-1101-12_pin_news_1996_659277.txt-123-8,2 Distantly Related 3 Closely Related 3 Closely Related,"Dunn was in plainclothes, a gold and blue lieutenant's shield pinned to the breast pocket of his beautifully tailored, sand-colored whipcord suit. || Dunn was in plainclothes, a gold and blue lieutenant's shield pinned to the breast pocket of his beautifully tailored, sand-colored whipcord suit. || Dunn was in plainclothes, a gold and blue lieutenant's shield pinned to the breast pocket of his beautifully tailored, sand-colored whipcord suit. || Dunn was in plainclothes, a gold and blue lieutenant's shield pinned to the breast pocket of his beautifully tailored, sand-colored whipcord suit. || Dunn was in plainclothes, a gold and blue lieutenant's shield pinned to the breast pocket of his beautifully tailored, sand-colored whipcord suit. || Dunn was in plainclothes, a gold and blue lieutenant's shield pinned to the breast pocket of his beautifully tailored, sand-colored whipcord suit."
pinned_fic_1976_780103.txt-1101-12_pin_news_1996_659277.txt-123-8,2 Distantly Related 3 Closely Related 3 Closely Related,"Nor are reporters stalking convention halls trying to pin such labels as "" right-wing "", "" conservative "" and "" extreme "" on the nearest unsuspecting delegates. || Nor are reporters stalking convention halls trying to pin such labels as "" right-wing "", "" conservative "" and "" extreme "" on the nearest unsuspecting delegates. || Nor are reporters stalking convention halls trying to pin such labels as "" right-wing "", "" conservative "" and "" extreme "" on the nearest unsuspecting delegates. || Nor are reporters stalking convention halls trying to pin such labels as "" right-wing "", "" conservative "" and "" extreme "" on the nearest unsuspecting delegates. || Nor are reporters stalking convention halls trying to pin such labels as "" right-wing "", "" conservative "" and "" extreme "" on the nearest unsuspecting delegates. || Nor are reporters stalking convention halls trying to pin such labels as "" right-wing "", "" conservative "" and "" extreme "" on the nearest unsuspecting delegates."
pinned_fic_1977_16209.txt-884-5_pin_fic_2008_36140.txt-123-7,2 Distantly Related,"Olive Oyl joined in, helping to pin her down. || Olive Oyl joined in, helping to pin her down."
