annotation_lbl,category,sentence
Donkey_fic_1987_782034.txt-8660-41_donkeys_fic_1984_10723.txt-1278-9,Identical,"Well, hell, Marty, "" said Kramer, figuring that, having been a fellow soldier with him in the bullshit skirmish at Reverend Bacon's, he could go on a nickname basis with the dauntless little Irish Donkey, "" the kids || Let you play in the mountains while I bring donkeys out to work and pick olives?"
Lass_mag_1835_565217.txt-61-8_lass_fic_1993_1040075.txt-3226-4,Closely Related,"Perfection whispered, passing by, Behold the Lass of Ballochmyle. ' || A plump, lively lass: Mirina was her name."
MaxIm_mag_2004_413046.txt-47-7_maxim_fic_1835_7133.txt-1935-29,Unrelated,"Such familiar software names as TheSky, MaxIm DL, and Astronomer's Control Panel are installed on his machines. || inquired a young Bostonian, forgetful of his orthodox habits -- last Sabbath evening, twirling while he spoke a ticket in his fingers -- "" you know the maxim -- when one is in Rome "" -- "" I have not been here quite long enough yet to apply the rule, "" said I; "" is not the theatre open on other evenings of the week? """
MaxIm_mag_2004_413046.txt-47-7_maxims_mag_1826_553699.txt-30-27,Closely Related,"Such familiar software names as TheSky, MaxIm DL, and Astronomer's Control Panel are installed on his machines. || , and coinmotion from within; to secure peace and prosperity at home, and importance and respect abroad; to settle on definite grounds those political maxims, which for ages unnumbered will regulate the intercourse of nations, whose infancy will soon grow into a powerful manhood; to concert all the plans, in short, which wisdom can devise, and union execute, for increasing the strength and prosperity of every branch of the confederacy; these are some of the points to be considered at the Congress of Panam * m."
Maxim_fic_1963_16356.txt-79-8_maxim_mag_1849_525201.txt-349-29,Unrelated,"NARRATOR 'S VOICEIf you want a night-cap at Maxim's, it's too late -- it's been closed for hours. || And instead of laying so much stress on opinion, as if this were the only matter of unity, how much better would it be to remember the maxim acted upon of old, by different parties in the Church, that "" Catholics, as Catholics, agree always in matters of faith, and good Catholics never break charity, but the best Catholics, as men, may vary in their opinions"
Maxim_nf_1994_773479.txt-114-34_maxim_nf_1837_772749.txt-855-6,Unrelated,"The St. Louis native had picked up most of his boxing experience in the military service, where he fought exhibition bouts with Joe Louis and former lightheavyweight champion of the world, Joey Maxim. || There are no occasions when this maxim is more needed, than when we wish to modify the opinions, or alter the practices of our fellow-men."
Rags_fic_1843_7208.txt-513-8_rags_fic_1830_8660.txt-616-9,Closely Related,"Come, fork over the solid, Old Rags, "" said the boatman, with a loud laugh, and turning with a quizzical leer to a group of captains, and sloop-boys that had gathered to see the fun. "" || ANSELMO They come From princes that are traffickers in rags."
Rags_fic_1843_7208.txt-513-8_rags_mag_1840_586584.txt-140-47,Identical,"Come, fork over the solid, Old Rags, "" said the boatman, with a loud laugh, and turning with a quizzical leer to a group of captains, and sloop-boys that had gathered to see the fun. "" || There is a higher pleasure in his view in preachiiig to the savages, than in sharing the luxuries of refined society; and in preferring the former he acts upon the same principle of self-love, as the chimney sweeper would in giving up his sooty rags for the purple linen of a prince."
attack_fic_1854_9193.txt-8301-13_attack_fic_1848_7009.txt-1181-32,Identical,"But then, the work itself, with the exception of a feeble attack now and then from the prolific pen of Skimmer, (who wrote for several publications,) was noticed by the press with favour. || I gathered from him enough to convince me that my fears, which I have already spoken of, were true; and as I afterwards heard the facts of that fatal attack, I will here relate them to you. """
attack_fic_1993_25035.txt-820-7_attack_news_1998_626765.txt-4-8,Identical,""" I understand she had a heart attack, "" Regan said quietly. "" || In 1835, when Ben Milam ordered an attack on San Antonio, one group refused to obey the order until Arnold could return from a scouting trip to lead them."
attack_mag_1845_555245.txt-299-1_attacks_news_1991_612479.txt-40-20,Identical,"The attack of the Boston Teachers upon the Board of Education and its Secretary has failed, - signally and disgracefully failed. || The AIDS virus insinuates itself into the genetic makeup of T cells, destroying them or preventing them from orchestrating attacks on disease organisms."
attack_news_1967_726451.txt-39-2_attack_fic_1838_7086.txt-2732-33,Identical,"Faisal under attack With the exception of heavy Algerian and Sudanese involvement, the degree of other Arab militancy drops rapidly in direct proportion to distance from Israel. || being protected by the batteries of New-York, Governor's Island, and Red Hook; that, on the arrival of their fleet through the Sound, instead of making a direct attack on New-York, they should land at Kingsbridge, and take up a position across the island of New-York, cut off all communication with the mainland, and, blockading General Washington by land and water, compel him to capitulate on their own terms. """
attack_news_1982_671107.txt-19-96_attacks_news_1966_725841.txt-34-33,Identical,"We believe that the United States should pursue, on an urgent basis, serious strategic arms control negotiations consistent with the maintenance of overall parity with the Soviet Union, including, to the fullest extent possible: // - A mutual and verifiable freeze on the testing, production, and deployment of nuclear warheads, missiles and other delivery systems; // - Major, mutual, balanced and verifiable reductions of nuclear forces to lower equivalent levels, with special attention to destabilizing weapons that are vulnerable to or capable of preemptive attack; // - Strict adherence by both sides to all arms control agreements negotiated to date; // - Measures to prevent the use of nuclear weapons by each superpower, such as expanding political and technical mechanisms to reduce the risk of war by accident or miscalculation, including hot lines among nuclear weapons states and joint United States/Soviet stations to enhance the command and control of nuclear weapons systems; // - Systematic multilateral efforts, both political and technical, to restrain the reckless commerce in sensitive || They feel the war in Vietnam could be concluded honorably if only the parties concerned accepted U Thant's three points, beginning with the first which calls for the suspension of air attacks on North Vietnam."
attack_news_1998_626765.txt-4-8_attack_news_1967_726451.txt-39-2,Identical,"In 1835, when Ben Milam ordered an attack on San Antonio, one group refused to obey the order until Arnold could return from a scouting trip to lead them. || Faisal under attack With the exception of heavy Algerian and Sudanese involvement, the degree of other Arab militancy drops rapidly in direct proportion to distance from Israel."
attacks_news_1966_725841.txt-34-33_attack_fic_2009_36778.txt-461-18,Identical,"They feel the war in Vietnam could be concluded honorably if only the parties concerned accepted U Thant's three points, beginning with the first which calls for the suspension of air attacks on North Vietnam. || I didn't mean it to come out that harshly, but damn it, I felt under attack here."
attacks_news_1991_612479.txt-40-20_attack_fic_1968_781997.txt-4233-2,Identical,"The AIDS virus insinuates itself into the genetic makeup of T cells, destroying them or preventing them from orchestrating attacks on disease organisms. || The dreadful attack upon Crystal Knox had been the more dramatic aspect of it; but the fact that, even after that warning, Ted had actually been about to let himself be dragged into the vortex of the so-called "" Peace Party "" movement was, in Ceil's mind, far more fundamental and frightening"
ball_fic_1854_9218.txt-3589-17_ball_fic_1842_555.txt-2985-38,Identical,"He never came near me all day, and toward night I began to dress for the ball. || There, once in a while, was seen the thin, care-worn, melancholy visage of an old tory, with a Wig that, in times long past, had perhaps figured at a Province House ball."
ball_mag_1835_554348.txt-508-19_ball_fic_2000_27978.txt-555-1,Identical,"The a-frighted birds fled swiftly, gathering themselves into a mass so dense, that it resembled a black ball. || eight ball, but I 'm going to drag her down to Be-Stitched the minute she gets here and force her to make a decision. """
ball_nf_1838_747482.txt-1194-43_ball_fic_1842_555.txt-2985-38,Identical,"Billiards, cards, Pharo and other games of hazard, are to be found at every hundred steps, in every street and alley of Paris; haunted by blacklegs in waiting for your purse; and there is scarce a private ball or soiree, even to those of the court, in which immense sums are not lost and won, by gambling. || There, once in a while, was seen the thin, care-worn, melancholy visage of an old tory, with a Wig that, in times long past, had perhaps figured at a Province House ball."
balls_fic_1842_7206.txt-3298-50_ball_fic_2006_27868.txt-115-4,Unrelated,"And yet the Round-Rimmers condescend to join the common world in certain of their observances; they have committees, among themselves, where small men swell into great, by dint of volubility and intrigue; they make presentations after their fashion to distinguished men; and give complimentary balls, where they get a fever to a boiling pitch. || As always, the ball exploded off his club face and rode the soft wind to disappear beyond the sloping fairway and run a dozen yards farther, leaving him a short iron to the green."
balls_mag_1985_432241.txt-96-3_balls_mag_1854_566434.txt-121-2,Identical,"Covered with metallic balls for discharging electrical energy, the monstrous contraption seemed fit for a horror || of the balls, shaped out of rock, nearly two feet in diameter, such as used to be employed when it was fired, lie near at hand."
bit_fic_1818_7631.txt-303-79_bit_fic_1832_9464.txt-182-10,Distantly Related,"Doat on her charms, as misers doat on pelf And like Narcissus pines for pretty self, Check her betimes, before too late you find Self love the ruling passion of her mind; Ere she assume those gestures, and grimaces, Which pretty simpletons mistake for graces, Who set themselves up beauties by profession, And think to hold all hearts in their possession, (As boys string bird's eggs on a bit of thread) By charms, which rival goddesses might dread. || What hope is there of the quadruped's ever bearing bit or bridle, when even the want of food won't make him docile?"
bit_fic_1823_7248.txt-2489-20_bit_fic_1998_43216.txt-276-4,Undecidable,"Brother, ' said I, as we stood side by side, again, holding our horses by the bit and throat lash, to steady them, under the movement of the boat -- this is the third time that || I 'm feeling a bit faint from the heat, "" Lady Dustan said."
bit_fic_1840_7332.txt-1696-11_bit_fic_1832_9464.txt-182-10,Unrelated,"I say, stranger, here's a house -- a bit of a tavern, I suppose; yes, there are wagons -- and there's a light in the bar-room -- they be in || What hope is there of the quadruped's ever bearing bit or bridle, when even the want of food won't make him docile?"
bit_fic_1848_7193.txt-9902-12_bit_fic_1823_7248.txt-2489-20,Unrelated,"And now I'll take some bread and cheese, or a bit of cold chicken and a mug of cider, with a pipe of tobacco. || Brother, ' said I, as we stood side by side, again, holding our horses by the bit and throat lash, to steady them, under the movement of the boat -- this is the third time that"
bit_fic_1849_7167.txt-913-19_bit_fic_1848_7193.txt-9902-12,Identical,"Joseph, "" said I, interrupting him, "" you'll spoil that book; here's a bit of paper, if you wish to make more calculations. "" || And now I'll take some bread and cheese, or a bit of cold chicken and a mug of cider, with a pipe of tobacco."
bit_fic_1964_10453.txt-834-4_bit_fic_1818_7631.txt-303-79,Identical,"There's always a bit of money to be had for a worthy cause in Boston. || Doat on her charms, as misers doat on pelf And like Narcissus pines for pretty self, Check her betimes, before too late you find Self love the ruling passion of her mind; Ere she assume those gestures, and grimaces, Which pretty simpletons mistake for graces, Who set themselves up beauties by profession, And think to hold all hearts in their possession, (As boys string bird's eggs on a bit of thread) By charms, which rival goddesses might dread."
chef_fic_1827_7168.txt-915-10_chef_fic_2005_50340.txt-357-17,Unrelated,"his tour, for his return was accompanied by sundry chef d'oeuvres of the Dutch artists, as is remembered to this day, from his unbounded liberality -- for in the generosity of his heart he bestowed on the Stadt one Amsterdam Apollo without a nose, moulded at the lime kilns in Overyssel; a Venus, cut by Edric Vanderkunderspuke, without a leg; and a Cupid and Psyche without heads but of admirable form, the one being dressed in a field marshal's uniform and the other in a hoop and stomacher. || Jean-Paul had thrown together the food, though he rarely cooked at home: he was a chef now, in his father's restaurant."
chef_fic_2007_33461.txt-116-19_chef_fic_1992_40323.txt-77-14,Closely Related,"Because my next-door neighbor, Obax Geeddi Abtidoon, a rich and beautiful Somalian who wanted to be a chef but was getting her degree in polar studies when she wasn't cooking curry and making sliced carrot salad for everyone on the floor, had given me the ginger beer starter and how could I be so rude as to throw it out? || Sherry Tualaulelei was instrumental in the conviction and thirty-three year imprisonment of the pastry chef's boss, Sinio "" Sally Comfort "" Conforte, who had "" borrowed "" a car to sneak out for a visit to his mistress."
chef_news_1995_631270.txt-48-3_chef_mag_1836_554393.txt-176-6,Unrelated,"Ever the practical chef, she pulls out store-bought pumpkin seeds to make pesto for the frittata when the zucchini she opens do not yield mature-enough seeds to roast. || He boasted of having been a chef de brigade in the republican armies of France; but, such was his ardor in the cause, that he accepted the humble rank of chef de cuisine in the service of Toledo."
chef_nf_1977_774125.txt-1297-15_chefs_fic_2004_32588.txt-86-3,Identical,"The meaning was pretty clear, but Newsweek spelled it out, saying that the chef "" routinely expresses contempt for women in the kitchen. || the kitchen when chefs would let him get away with it. """
chef_nf_1991_774072.txt-1394-40_chef_fic_1848_1108.txt-660-44,Closely Related,"A traditional recipe is given in chapter 4, but, as noted there, different herbs and vegetables can be used, depending on the type of fish being prepared, the region, and the whim of the chef. || He was a young man who much preferred a state of self-satisfaction to humiliation of any sort, and after he had endured Clementina's gaze as long as he could, he said, "" Perhaps you don't allow anybody but the chef to call you that? """
chefs_fic_2004_32588.txt-86-3_chef_fic_1995_39282.txt-307-1,Identical,"the kitchen when chefs would let him get away with it. "" || The chef had cooked the tongue to perfection -- tender and not too done, just shy of bloody."
chefs_nf_1977_774125.txt-1398-15_chef_fic_2005_50340.txt-357-17,Identical,"Now, Bocuse knows all this, and he is one of the most brilliant chefs in France. || Jean-Paul had thrown together the food, though he rarely cooked at home: he was a chef now, in his father's restaurant."
circle_fic_1839_8627.txt-1994-11_circling_fic_1854_70.txt-2012-8,Identical,"See how they bear him up upon their wings, And circle him with glory! || Or sometimes I watched a pair of hen-hawks circling high in the sky, alternately soaring and descending, approaching, and leaving one another, as if they were the embodiment of my own thoughts."
circled_fic_1852_593.txt-1202-17_circled_fic_1978_782020.txt-1272-1,Identical,"Those pleasantly swelling slopes of our farm, descending towards the wide meadows, through which sluggishly circled the brimful tide of the Charles, bathing the long sedges on its hither and farther shores; the broad, sunny gleam over the winding water; that peculiar picturesqueness of the scene where capes and headlands put themselves boldly forth upon the perfect level of the || Janet circled him at a distance as though he might still be dangerous."
circled_fic_1973_10569.txt-2907-9_circling_fic_1846_7036.txt-2560-11,Identical,"A new concrete road ran up to it and circled it to rejoin itself and fade away into the dun thistle-strewn hills. || They were not aware that the spirit of a nightingale was circling round them and would pass into the soul of their infant son, whom they named Felix Mendelssohn."
circled_mag_1823_553451.txt-373-54_Circled_mag_1840_554815.txt-207-38,Identical,"May it plea * e your lordships: I shall humbly crave at your lordships ' hands a benign interpretation of that which I shall now ivrte; for words that come from wasted spirits and an oppressed mind are more safe in being deposited in a noble construction, than in heir * circled with and reserved || lie soon Saw within ken a glorious Angel stand, The same whom John saw also in the sun: His back was turned, but not his brightness hid; Of beaming sunny rays a golden tiar Circled his head, nor less his locks behind Illustrious on his shoulders fledge with wings Lay waving round; on some great charge employed He seemed, or fixed in cogitation deep. """
circling_fic_1843_7155.txt-169-45_circled_fic_1989_780083.txt-2098-19,Distantly Related,"not traversed half the space between her and their nearest barque, before, with an explosion that might be heard leagues away into the pathless forest, startling the wild beast and the wilder Indian in his lair, and with a wide and circling glare that for an instant made the broad daylight pallid, the caravel blew up! || As soon as he got there, a host of white flowers flew up from under his feet and circled above him anxiously like startled pigeons."
circling_fic_1965_780079.txt-1535-10_circled_fic_1967_781996.txt-4609-2,Identical,"He did not stop moving, but kept circling, circling, knees bent, in a kind of squat; as he passed the table he seized a bottle by the neck and broke it in half -- crack -- on the table edge, and kept moving. || | They circled the hotel once, everybody looking down at the sprawling buildings and the docks and at the manager who came running out waving his arms."
circling_fic_1986_782032.txt-994-11_circling_nf_1849_749269.txt-626-4,Distantly Related,"Instead, they got all their electronic information from the two circling E-2C air-surveillance aircraft, known colloquially as Hummers, whose radars swept a circle over four hundred miles across || he said again, circling back to his favorite maxim."
circling_fic_2001_14559.txt-2980-18_circle_fic_1839_8627.txt-1994-11,Identical,"And all around me people shouting, shouting and something like water rushing in through my head and circling my skull. || See how they bear him up upon their wings, And circle him with glory!"
circling_nf_1849_749269.txt-626-4_circled_fic_1852_593.txt-1202-17,Identical,"he said again, circling back to his favorite maxim. || Those pleasantly swelling slopes of our farm, descending towards the wide meadows, through which sluggishly circled the brimful tide of the Charles, bathing the long sedges on its hither and farther shores; the broad, sunny gleam over the winding water; that peculiar picturesqueness of the scene where capes and headlands put themselves boldly forth upon the perfect level of the"
circling_nf_1849_749269.txt-626-4_circling_fic_1843_7155.txt-169-45,Distantly Related,"he said again, circling back to his favorite maxim. || not traversed half the space between her and their nearest barque, before, with an explosion that might be heard leagues away into the pathless forest, startling the wild beast and the wilder Indian in his lair, and with a wide and circling glare that for an instant made the broad daylight pallid, the caravel blew up!"
donkey_fic_1855_602.txt-4503-54_donkey_mag_1966_211235.txt-8-4,Identical,"The wood is of a dark brown hue, but retains its form in perfection, the pieces being from one to fifteen feet in length, and from half a foot to three feet in thickness, strewed so closely together, as far as the eye can reach, that an Egyptian donkey can scarcely thread its way through amongst them, and so natural that, were it in Scotland or Ireland, it might pass without remark for some enormous drained bog, on which the exhumed trees lay rotting in the sun. || There's a big donkey population in this country around this time of year. """
donkey_fic_1993_1040075.txt-591-5_donkey_mag_1966_211235.txt-8-4,Identical,"Should you ever meet another donkey, I trust you'll do as well || There's a big donkey population in this country around this time of year. """
donkey_fic_1994_54030.txt-305-13_donkey_mag_1966_211235.txt-8-4,Identical,"To some it sounds like a mob of crows, to others a donkey's bray. || There's a big donkey population in this country around this time of year. """
donkey_nf_1852_752548.txt-796-22_donkey_fic_1860_616.txt-3124-92,Identical,"A lady once told him in jest that her youngest brother, a lad of twelve years old, had called his donkey Braham, in honour of the great singer of that name. || All these innumerable eyes looked down into the street, the whole capacity of which was thronged with festal figures, in such fantastic variety that it had taken centuries to contrive them; and through the midst of the mad, merry stream of human life rolled slowly onward a never-ending procession of all the vehicles in Rome, from the ducal carriage, with the powdered coachman high in front, and the three golden lackeys clinging in the rear, down to the rustic cart drawn by its single donkey."
donkeys_fic_1994_41307.txt-1046-52_donkeys_fic_1984_10723.txt-1278-9,Identical,"I told her her body was rich and lovely but her mind was richer and lovelier and more durable -- for although she was partly of our kind, she was a mortal being, like you -- djinns and mortals can not produce an immortal scion, you know, as donkeys and horses can only produce a seedless mule. || Let you play in the mountains while I bring donkeys out to work and pick olives?"
donkeys_nf_1838_747585.txt-3-21_donkeys_fic_1984_10723.txt-1278-9,Identical,"Winding his doubtful and perilous way among tottering and ruined houses, jostled by camels, dromedaries, horses, and donkeys, perhaps he will draw up against a wall, and, thinking of plague, hold his breath and screw himself into nothing, while he allows a corpse to pass, followed by a long train of howling women, dressed in black, with masks over their faces; and entering || Let you play in the mountains while I bring donkeys out to work and pick olives?"
donkeys_nf_1838_747585.txt-3-21_donkeys_fic_1997_54593.txt-116-14,Identical,"Winding his doubtful and perilous way among tottering and ruined houses, jostled by camels, dromedaries, horses, and donkeys, perhaps he will draw up against a wall, and, thinking of plague, hold his breath and screw himself into nothing, while he allows a corpse to pass, followed by a long train of howling women, dressed in black, with masks over their faces; and entering || could have guessed which building was Branas ' from the number of horses and donkeys tied up in front of it."
donkeys_nf_1838_747585.txt-438-30_donkey_nf_1852_752548.txt-796-22,Identical,"As she grew up, she went out occasionally alone; and even among the Turks her interesting little figure made her a favourite; and when all the other donkeys were idle, hers was sure to be engaged. || A lady once told him in jest that her youngest brother, a lad of twelve years old, had called his donkey Braham, in honour of the great singer of that name."
donkeys_nf_1838_747585.txt-438-30_donkeys_fic_1839_7352.txt-1973-3,Identical,"As she grew up, she went out occasionally alone; and even among the Turks her interesting little figure made her a favourite; and when all the other donkeys were idle, hers was sure to be engaged. || Small droves of donkeys, with their panniers filled with the firmly moulded product of the mine, wind along the highway, and far above appears the Girgenti on the summit of a mountain."
edge_fic_1823_7249.txt-942-61_edge_mag_1990_342665.txt-15-8,Unrelated,"I looked a moment though I was hotly engaged with two good swordsmen, in the expectation of seeing him fall; but, in a twinkling, he was out of sight, his blade rattling like hail, about the bayonets that hedged him in, as he passed in a circle of incessant fire, giving point and edge, at the same moment. || Gucci should be classic, but with an edge, "" she says. """
edge_fic_1975_10598.txt-6073-22_edge_fic_1985_10731.txt-8264-5,Identical,"We walked the fifty yards up to a washy-looking razorback, and Tracker pointed to a couple of clear footprints at the edge of a dry claypool. "" || He pushed it over the edge and leaped after it."
