annotation_lbl,categories,sentences
circled_fic_1842_7206.txt-4043-53_circled_fic_1848_7186.txt-245-10,2 Distantly Related 3 Closely Related,"The diners were meanwhile fairly embarked -- the stream of mirth was full: as it flowed up and down the board it sometimes attained a rapid head, carrying all before it, in a general glee; or paused in little eddies and islets of drinkers, where it tarried and circled round and round within itself. || The diners were meanwhile fairly embarked -- the stream of mirth was full: as it flowed up and down the board it sometimes attained a rapid head, carrying all before it, in a general glee; or paused in little eddies and islets of drinkers, where it tarried and circled round and round within itself. || The diners were meanwhile fairly embarked -- the stream of mirth was full: as it flowed up and down the board it sometimes attained a rapid head, carrying all before it, in a general glee; or paused in little eddies and islets of drinkers, where it tarried and circled round and round within itself. || The diners were meanwhile fairly embarked -- the stream of mirth was full: as it flowed up and down the board it sometimes attained a rapid head, carrying all before it, in a general glee; or paused in little eddies and islets of drinkers, where it tarried and circled round and round within itself."
circled_fic_1851_746.txt-7466-23_circled_fic_1833_7059.txt-360-2,2 Distantly Related,"The wine circled gaily, and the song and jest passed merrily round. || The wine circled gaily, and the song and jest passed merrily round."
circled_fic_1851_746.txt-7466-23_circling_mag_1999_402759.txt-307-20,4 Identical,"It is humbling to realize that still other totally different kinds of planets, beyond our imagining, must be circling stars elsewhere in the galaxy. || It is humbling to realize that still other totally different kinds of planets, beyond our imagining, must be circling stars elsewhere in the galaxy."
circled_fic_1852_593.txt-1202-17_circle_fic_1986_782032.txt-1834-19,2 Distantly Related 0 Undecidable,"Instantly, a crewman flipped a switch to deploy a smoke marker and the aircraft turned hard right to circle back on the contact point. "" || Instantly, a crewman flipped a switch to deploy a smoke marker and the aircraft turned hard right to circle back on the contact point. "" || Instantly, a crewman flipped a switch to deploy a smoke marker and the aircraft turned hard right to circle back on the contact point. "" || Instantly, a crewman flipped a switch to deploy a smoke marker and the aircraft turned hard right to circle back on the contact point. """
circled_fic_1853_7455.txt-645-20_circling_fic_1849_8065.txt-54-17,2 Distantly Related 4 Identical 2 Distantly Related,"When the smoothed ocean sleeps unstirred, And, like a silver band, The molten waters circling gird The island's rim of sand, She runs her tiny feet to lave, And breaks the liquid chain; Then laughs to feel the shivered wave Coil down to rest again. || When the smoothed ocean sleeps unstirred, And, like a silver band, The molten waters circling gird The island's rim of sand, She runs her tiny feet to lave, And breaks the liquid chain; Then laughs to feel the shivered wave Coil down to rest again. || When the smoothed ocean sleeps unstirred, And, like a silver band, The molten waters circling gird The island's rim of sand, She runs her tiny feet to lave, And breaks the liquid chain; Then laughs to feel the shivered wave Coil down to rest again. || When the smoothed ocean sleeps unstirred, And, like a silver band, The molten waters circling gird The island's rim of sand, She runs her tiny feet to lave, And breaks the liquid chain; Then laughs to feel the shivered wave Coil down to rest again. || When the smoothed ocean sleeps unstirred, And, like a silver band, The molten waters circling gird The island's rim of sand, She runs her tiny feet to lave, And breaks the liquid chain; Then laughs to feel the shivered wave Coil down to rest again. || When the smoothed ocean sleeps unstirred, And, like a silver band, The molten waters circling gird The island's rim of sand, She runs her tiny feet to lave, And breaks the liquid chain; Then laughs to feel the shivered wave Coil down to rest again."
circled_fic_1853_9158.txt-568-37_circled_fic_1981_10676.txt-3345-11,3 Closely Related,"It was not many minutes before the first returned, bearing the tidings that they were close at hand, halted, as it seemed, for the evening, in a small green savannah, half circled by a swampy streamlet. || It was not many minutes before the first returned, bearing the tidings that they were close at hand, halted, as it seemed, for the evening, in a small green savannah, half circled by a swampy streamlet."
circled_fic_1853_9158.txt-568-37_circled_fic_1981_10676.txt-3345-11,3 Closely Related,"You go along Gorki Street and within ten minutes you've circled back to the same sagging glory-to-Lenin sign you started from, and these resigned, contentious crowds shufflingabout, all you smell is solitude and fear.... "" In Moscow the three travelers have become more detached from each other, the triad tends to split into its separate tones, Claire on her * * 29; 8467; TOOLONG gun in your lap, and carrying it around under your coat ain't making things better. || You go along Gorki Street and within ten minutes you've circled back to the same sagging glory-to-Lenin sign you started from, and these resigned, contentious crowds shufflingabout, all you smell is solitude and fear.... "" In Moscow the three travelers have become more detached from each other, the triad tends to split into its separate tones, Claire on her * * 29; 8467; TOOLONG gun in your lap, and carrying it around under your coat ain't making things better."
circled_fic_1961_781980.txt-1331-7_circled_fic_2003_31844.txt-29-3,4 Identical,"He had already circled our block about ten times in a row and each time he got a little closer to the house, as if he were zeroing in on a target. || He had already circled our block about ten times in a row and each time he got a little closer to the house, as if he were zeroing in on a target."
circled_fic_1961_781980.txt-1331-7_circled_fic_2003_31844.txt-29-3,4 Identical,"They walked down the gravel path, circled the pool and fountain. || They walked down the gravel path, circled the pool and fountain."
circled_fic_1967_781996.txt-4609-2_circled_fic_1851_746.txt-7466-23,3 Closely Related 2 Distantly Related,"| They circled the hotel once, everybody looking down at the sprawling buildings and the docks and at the manager who came running out waving his arms. || | They circled the hotel once, everybody looking down at the sprawling buildings and the docks and at the manager who came running out waving his arms. || | They circled the hotel once, everybody looking down at the sprawling buildings and the docks and at the manager who came running out waving his arms. || | They circled the hotel once, everybody looking down at the sprawling buildings and the docks and at the manager who came running out waving his arms."
circled_fic_1967_781996.txt-4609-2_circled_fic_1851_746.txt-7466-23,3 Closely Related 2 Distantly Related 4 Identical 4 Identical 4 Identical,"As we glided nearer, the stranger showed French colours from his peak; and by the eddying cloud of vulture sea-fowl that circled, and hovered, and swooped around him, it was plain that the whale alongside must be what the fishermen call a blasted whale, that is, a whale that has died unmolested on the sea, and so floated an unappropriated corpse. || As we glided nearer, the stranger showed French colours from his peak; and by the eddying cloud of vulture sea-fowl that circled, and hovered, and swooped around him, it was plain that the whale alongside must be what the fishermen call a blasted whale, that is, a whale that has died unmolested on the sea, and so floated an unappropriated corpse. || As we glided nearer, the stranger showed French colours from his peak; and by the eddying cloud of vulture sea-fowl that circled, and hovered, and swooped around him, it was plain that the whale alongside must be what the fishermen call a blasted whale, that is, a whale that has died unmolested on the sea, and so floated an unappropriated corpse. || As we glided nearer, the stranger showed French colours from his peak; and by the eddying cloud of vulture sea-fowl that circled, and hovered, and swooped around him, it was plain that the whale alongside must be what the fishermen call a blasted whale, that is, a whale that has died unmolested on the sea, and so floated an unappropriated corpse. || As we glided nearer, the stranger showed French colours from his peak; and by the eddying cloud of vulture sea-fowl that circled, and hovered, and swooped around him, it was plain that the whale alongside must be what the fishermen call a blasted whale, that is, a whale that has died unmolested on the sea, and so floated an unappropriated corpse. || As we glided nearer, the stranger showed French colours from his peak; and by the eddying cloud of vulture sea-fowl that circled, and hovered, and swooped around him, it was plain that the whale alongside must be what the fishermen call a blasted whale, that is, a whale that has died unmolested on the sea, and so floated an unappropriated corpse. || As we glided nearer, the stranger showed French colours from his peak; and by the eddying cloud of vulture sea-fowl that circled, and hovered, and swooped around him, it was plain that the whale alongside must be what the fishermen call a blasted whale, that is, a whale that has died unmolested on the sea, and so floated an unappropriated corpse. || As we glided nearer, the stranger showed French colours from his peak; and by the eddying cloud of vulture sea-fowl that circled, and hovered, and swooped around him, it was plain that the whale alongside must be what the fishermen call a blasted whale, that is, a whale that has died unmolested on the sea, and so floated an unappropriated corpse. || As we glided nearer, the stranger showed French colours from his peak; and by the eddying cloud of vulture sea-fowl that circled, and hovered, and swooped around him, it was plain that the whale alongside must be what the fishermen call a blasted whale, that is, a whale that has died unmolested on the sea, and so floated an unappropriated corpse. || As we glided nearer, the stranger showed French colours from his peak; and by the eddying cloud of vulture sea-fowl that circled, and hovered, and swooped around him, it was plain that the whale alongside must be what the fishermen call a blasted whale, that is, a whale that has died unmolested on the sea, and so floated an unappropriated corpse."
circled_fic_1973_10569.txt-2907-9_circled_fic_1837_7452.txt-82-4,2 Distantly Related,A new concrete road ran up to it and circled it to rejoin itself and fade away into the dun thistle-strewn hills. || A new concrete road ran up to it and circled it to rejoin itself and fade away into the dun thistle-strewn hills.
circled_fic_1973_10569.txt-2907-9_circled_fic_1837_7452.txt-82-4,2 Distantly Related 2 Distantly Related,"And the waves that circled round The eternal mount on high, Bore an everlasting sound To the soul that can not die. || And the waves that circled round The eternal mount on high, Bore an everlasting sound To the soul that can not die. || And the waves that circled round The eternal mount on high, Bore an everlasting sound To the soul that can not die. || And the waves that circled round The eternal mount on high, Bore an everlasting sound To the soul that can not die."
circled_fic_1978_782020.txt-1272-1_circled_fic_1985_10729.txt-5570-4,4 Identical,Janet circled him at a distance as though he might still be dangerous. || Janet circled him at a distance as though he might still be dangerous.
circled_fic_1978_782020.txt-1272-1_circled_fic_1985_10729.txt-5570-4,4 Identical 4 Identical 2 Distantly Related 2 Distantly Related,"The jerking stiff-jointed puppets circled him, shuffling and bobbingp229along the floorboards. || The jerking stiff-jointed puppets circled him, shuffling and bobbingp229along the floorboards. || The jerking stiff-jointed puppets circled him, shuffling and bobbingp229along the floorboards. || The jerking stiff-jointed puppets circled him, shuffling and bobbingp229along the floorboards. || The jerking stiff-jointed puppets circled him, shuffling and bobbingp229along the floorboards. || The jerking stiff-jointed puppets circled him, shuffling and bobbingp229along the floorboards. || The jerking stiff-jointed puppets circled him, shuffling and bobbingp229along the floorboards. || The jerking stiff-jointed puppets circled him, shuffling and bobbingp229along the floorboards."
circled_fic_1979_780092.txt-3208-1_circling_fic_1834_7252.txt-2825-11,2 Distantly Related,"They circled Pedestrian cautiously, like wrestlers looking for an opening. || They circled Pedestrian cautiously, like wrestlers looking for an opening."
circled_fic_1979_780092.txt-3208-1_circling_fic_1834_7252.txt-2825-11,2 Distantly Related 2 Distantly Related,"These grasping, the young god stood in the breach Of circling trees, with eye that fiercely glanced, Nostril expanded, lip pressed, foot advanced, And arrow at the string; when lo! || These grasping, the young god stood in the breach Of circling trees, with eye that fiercely glanced, Nostril expanded, lip pressed, foot advanced, And arrow at the string; when lo! || These grasping, the young god stood in the breach Of circling trees, with eye that fiercely glanced, Nostril expanded, lip pressed, foot advanced, And arrow at the string; when lo! || These grasping, the young god stood in the breach Of circling trees, with eye that fiercely glanced, Nostril expanded, lip pressed, foot advanced, And arrow at the string; when lo!"
circled_fic_1980_782023.txt-2137-4_circled_fic_1849_7216.txt-3199-16,2 Distantly Related,"So the Doge's tradition; thus Bello's: -- Ages ago, Dominora was circled by a reef, which expanding in proportion to the extension of the isle's naval dominion, in due time embraced the entire lagoon; and this marriage ring zoned all the world. || So the Doge's tradition; thus Bello's: -- Ages ago, Dominora was circled by a reef, which expanding in proportion to the extension of the isle's naval dominion, in due time embraced the entire lagoon; and this marriage ring zoned all the world."
circled_fic_1980_782023.txt-2137-4_circled_fic_1849_7216.txt-3199-16,2 Distantly Related 2 Distantly Related 2 Distantly Related,"No matter what problems circled, prowling and growling, around him, North never put down his whip and chair, invisible though they might be, and once he began directing, every person on the set was convinced that || No matter what problems circled, prowling and growling, around him, North never put down his whip and chair, invisible though they might be, and once he began directing, every person on the set was convinced that || No matter what problems circled, prowling and growling, around him, North never put down his whip and chair, invisible though they might be, and once he began directing, every person on the set was convinced that || No matter what problems circled, prowling and growling, around him, North never put down his whip and chair, invisible though they might be, and once he began directing, every person on the set was convinced that || No matter what problems circled, prowling and growling, around him, North never put down his whip and chair, invisible though they might be, and once he began directing, every person on the set was convinced that || No matter what problems circled, prowling and growling, around him, North never put down his whip and chair, invisible though they might be, and once he began directing, every person on the set was convinced that"
circled_fic_1980_782023.txt-2137-4_circling_fic_1848_7193.txt-1542-39,2 Distantly Related,"And even through the blue sky, he could look up, and see these spirits -- or to speak in language which may be more intelligible -- these Men and Women of a purer and diviner creation, circling in myriad throngs of light and darkness. || And even through the blue sky, he could look up, and see these spirits -- or to speak in language which may be more intelligible -- these Men and Women of a purer and diviner creation, circling in myriad throngs of light and darkness."
circled_fic_1985_10729.txt-5570-4_circled_fic_1840_7164.txt-175-23,2 Distantly Related,"The alders are separated more widely from each other, and grow more in scattered clumps, which sometimes form green islets, circled with a fringe of scarlet, wherever their red roots are washed and polished by the flowing waters. || The alders are separated more widely from each other, and grow more in scattered clumps, which sometimes form green islets, circled with a fringe of scarlet, wherever their red roots are washed and polished by the flowing waters."
circled_fic_1986_782032.txt-5194-2_circle_nf_1827_747521.txt-163-33,2 Distantly Related,"Let 6/, be the central hne; divide it into four parts, and at one fourth make the hne a b across the column; on c, make the half circle a e b; with the distance / 1, at the neck of the column, and on 1, on the central hne, make the points 1, 1, on the circle; divide from 1 to c, || Let 6/, be the central hne; divide it into four parts, and at one fourth make the hne a b across the column; on c, make the half circle a e b; with the distance / 1, at the neck of the column, and on 1, on the central hne, make the points 1, 1, on the circle; divide from 1 to c,"
circled_fic_1986_782032.txt-5194-2_circle_nf_1827_747521.txt-163-33,2 Distantly Related,The Nimrod circled two hundred miles east of Jan Mayen || The Nimrod circled two hundred miles east of Jan Mayen
circled_fic_1992_53574.txt-214-2_circled_mag_2000_413181.txt-228-13,2 Distantly Related,"Father Smyth, tending the wounded, was met by a trooper who circled him, aiming a cocked pistol at his breast. || Father Smyth, tending the wounded, was met by a trooper who circled him, aiming a cocked pistol at his breast."
circled_fic_1992_53574.txt-214-2_circled_mag_2000_413181.txt-228-13,2 Distantly Related,"It was circled by a ring of pain, like fire, and the ring was pulsing. "" || It was circled by a ring of pain, like fire, and the ring was pulsing. """
circled_fic_2001_45947.txt-500-29_circled_mag_1977_431937.txt-45-14,4 Identical,"His captor began to pace the floor chain-smoking, holding the rope which still circled Todd's waist. || His captor began to pace the floor chain-smoking, holding the rope which still circled Todd's waist."
circled_fic_2001_45947.txt-500-29_circled_mag_1977_431937.txt-45-14,4 Identical,"The adults sat just as she had left them, eyes closed, mouths open slightly, their sound beating like a living thing, their thumbs and forefingers circled into perfect O's. || The adults sat just as she had left them, eyes closed, mouths open slightly, their sound beating like a living thing, their thumbs and forefingers circled into perfect O's."
circled_mag_1840_554815.txt-255-35_circled_fic_1837_7452.txt-82-4,2 Distantly Related,"A woman in distress affects most minds more strongly than a suffering angel; and this scene of purely human character served as a pretty touchstone, to try the sympathies of the many who circled the gallery. || A woman in distress affects most minds more strongly than a suffering angel; and this scene of purely human character served as a pretty touchstone, to try the sympathies of the many who circled the gallery."
circled_mag_1856_590750.txt-21-18_circling_mag_1973_280788.txt-28-1,2 Distantly Related,"// From that war the feeble and once-despised navy of the United States came out "" its forehead circled and adorned by the laurels it had torn from the brow of the naval genius of England || // From that war the feeble and once-despised navy of the United States came out "" its forehead circled and adorned by the laurels it had torn from the brow of the naval genius of England"
circled_nf_1842_747950.txt-723-15_circled_fic_2006_30107.txt-147-17,2 Distantly Related 0 Undecidable,"/z/ Heaven's wintry canopy covers our sphere, And the four sister seasons have circled the year; Returns cold December, with snows || /z/ Heaven's wintry canopy covers our sphere, And the four sister seasons have circled the year; Returns cold December, with snows || /z/ Heaven's wintry canopy covers our sphere, And the four sister seasons have circled the year; Returns cold December, with snows || /z/ Heaven's wintry canopy covers our sphere, And the four sister seasons have circled the year; Returns cold December, with snows"
circled_nf_1842_747950.txt-723-15_circled_fic_2006_30107.txt-147-17,2 Distantly Related 4 Identical,"The earth was thick with the scent of my prey-a deliberate move, as he weaved and circled, permeating this patch of forest with his smell, hoping to throw me off the trail. || The earth was thick with the scent of my prey-a deliberate move, as he weaved and circled, permeating this patch of forest with his smell, hoping to throw me off the trail. || The earth was thick with the scent of my prey-a deliberate move, as he weaved and circled, permeating this patch of forest with his smell, hoping to throw me off the trail. || The earth was thick with the scent of my prey-a deliberate move, as he weaved and circled, permeating this patch of forest with his smell, hoping to throw me off the trail."
circling_fic_1831_8376.txt-2445-23_circled_fic_1848_7992.txt-499-31,4 Identical,"The violent shock Shatters to vapor the descending sheets: A cloudy whirlwind fills the gulf, and heaves The mighty pyramid of circling mist To heaven. || The violent shock Shatters to vapor the descending sheets: A cloudy whirlwind fills the gulf, and heaves The mighty pyramid of circling mist To heaven."
circling_fic_1831_8376.txt-519-19_circled_fic_1860_8118.txt-3406-42,2 Distantly Related,"child, very old, over waves, toward the house of maternity, the land of migrations, look afar, Look off the shores of my Western Sea -- having arrived at last where I am -- the circle almost circled; For coming westward from Hindustan, from the vales of Kashmere, From Asia -- from the north -- from the God, the sage, and the hero, From the south -- from the flowery peninsulas, and the spice islands, Now I face the old home again -- looking over to it, joyous, as after long travel, growth, and sleep; But where is what I started for, so long ago? || child, very old, over waves, toward the house of maternity, the land of migrations, look afar, Look off the shores of my Western Sea -- having arrived at last where I am -- the circle almost circled; For coming westward from Hindustan, from the vales of Kashmere, From Asia -- from the north -- from the God, the sage, and the hero, From the south -- from the flowery peninsulas, and the spice islands, Now I face the old home again -- looking over to it, joyous, as after long travel, growth, and sleep; But where is what I started for, so long ago?"
circling_fic_1831_8376.txt-519-19_circled_fic_1860_8118.txt-3406-42,2 Distantly Related,"whose doors we now For social worship first unfold, To thee the suppliant throng shall bow, While circling years on years are rolled. || whose doors we now For social worship first unfold, To thee the suppliant throng shall bow, While circling years on years are rolled."
circling_fic_1834_7252.txt-2825-11_circled_fic_1848_7992.txt-499-31,2 Distantly Related 4 Identical,"'s reason to raise and refine, While lifting, untroubled, his gaze to the sky, He welcomed the Presence Divine; -- Then, coursing an orbit that circled the whole, Came Saturn, like Patience, untired, And through its broad range giving light to the soul Of Man, a calm wisdom inspired; -- And all these fair Planets in harmony move Round the Sun, as their centre of light, life and love. || 's reason to raise and refine, While lifting, untroubled, his gaze to the sky, He welcomed the Presence Divine; -- Then, coursing an orbit that circled the whole, Came Saturn, like Patience, untired, And through its broad range giving light to the soul Of Man, a calm wisdom inspired; -- And all these fair Planets in harmony move Round the Sun, as their centre of light, life and love. || 's reason to raise and refine, While lifting, untroubled, his gaze to the sky, He welcomed the Presence Divine; -- Then, coursing an orbit that circled the whole, Came Saturn, like Patience, untired, And through its broad range giving light to the soul Of Man, a calm wisdom inspired; -- And all these fair Planets in harmony move Round the Sun, as their centre of light, life and love. || 's reason to raise and refine, While lifting, untroubled, his gaze to the sky, He welcomed the Presence Divine; -- Then, coursing an orbit that circled the whole, Came Saturn, like Patience, untired, And through its broad range giving light to the soul Of Man, a calm wisdom inspired; -- And all these fair Planets in harmony move Round the Sun, as their centre of light, life and love."
circling_fic_1835_7328.txt-1942-40_circling_fic_1984_780041.txt-3391-5,2 Distantly Related,"Halleck has beautifully described similar scenery -- "" Tall spire, and glittering roof, and battlement, And banners floating in the sunny air, And white sails o'er the calm blue waters bent; Green isles, and circling shores, are blended there In wild reality! "" || Halleck has beautifully described similar scenery -- "" Tall spire, and glittering roof, and battlement, And banners floating in the sunny air, And white sails o'er the calm blue waters bent; Green isles, and circling shores, are blended there In wild reality! """
