annotation_lbl,categories,sentences
circling_nf_1855_748479.txt-213-16_circled_fic_1845_7162.txt-1633-28,2 Distantly Related 2 Distantly Related,"A broad-brimmed, low-crowned and long-napped white hat, set forth assuredly to the best advantage his rotund, rubicund, good-humored phiz; a clean white handkerchief circled his sturdy neck, on the volumnious folds of which reposed in placid dignity the mighty collops of his double chin. || A broad-brimmed, low-crowned and long-napped white hat, set forth assuredly to the best advantage his rotund, rubicund, good-humored phiz; a clean white handkerchief circled his sturdy neck, on the volumnious folds of which reposed in placid dignity the mighty collops of his double chin. || A broad-brimmed, low-crowned and long-napped white hat, set forth assuredly to the best advantage his rotund, rubicund, good-humored phiz; a clean white handkerchief circled his sturdy neck, on the volumnious folds of which reposed in placid dignity the mighty collops of his double chin. || A broad-brimmed, low-crowned and long-napped white hat, set forth assuredly to the best advantage his rotund, rubicund, good-humored phiz; a clean white handkerchief circled his sturdy neck, on the volumnious folds of which reposed in placid dignity the mighty collops of his double chin."
pin_fic_1835_7203.txt-1066-20_pinned_fic_1835_7309.txt-3622-1,2 Distantly Related 2 Distantly Related 3 Closely Related 2 Distantly Related 3 Closely Related,"Another pinned him by his sleeve to the spot; and his career in the next moment would probably have been ended, but for the timely appearance of Colonel Tarleton himself. || Another pinned him by his sleeve to the spot; and his career in the next moment would probably have been ended, but for the timely appearance of Colonel Tarleton himself. || Another pinned him by his sleeve to the spot; and his career in the next moment would probably have been ended, but for the timely appearance of Colonel Tarleton himself. || Another pinned him by his sleeve to the spot; and his career in the next moment would probably have been ended, but for the timely appearance of Colonel Tarleton himself. || Another pinned him by his sleeve to the spot; and his career in the next moment would probably have been ended, but for the timely appearance of Colonel Tarleton himself. || Another pinned him by his sleeve to the spot; and his career in the next moment would probably have been ended, but for the timely appearance of Colonel Tarleton himself. || Another pinned him by his sleeve to the spot; and his career in the next moment would probably have been ended, but for the timely appearance of Colonel Tarleton himself. || Another pinned him by his sleeve to the spot; and his career in the next moment would probably have been ended, but for the timely appearance of Colonel Tarleton himself. || Another pinned him by his sleeve to the spot; and his career in the next moment would probably have been ended, but for the timely appearance of Colonel Tarleton himself. || Another pinned him by his sleeve to the spot; and his career in the next moment would probably have been ended, but for the timely appearance of Colonel Tarleton himself."
pin_fic_1835_7203.txt-1066-20_pinned_fic_1835_7309.txt-3622-1,2 Distantly Related 4 Identical 2 Distantly Related 2 Distantly Related 3 Closely Related 2 Distantly Related 2 Distantly Related 3 Closely Related 2 Distantly Related,"must make the best selections; they therefore forego the trouble of forming an opinion of their own, and pin their faith upon the decisions -- or rather the practice, of the amateurs. || must make the best selections; they therefore forego the trouble of forming an opinion of their own, and pin their faith upon the decisions -- or rather the practice, of the amateurs. || must make the best selections; they therefore forego the trouble of forming an opinion of their own, and pin their faith upon the decisions -- or rather the practice, of the amateurs. || must make the best selections; they therefore forego the trouble of forming an opinion of their own, and pin their faith upon the decisions -- or rather the practice, of the amateurs. || must make the best selections; they therefore forego the trouble of forming an opinion of their own, and pin their faith upon the decisions -- or rather the practice, of the amateurs. || must make the best selections; they therefore forego the trouble of forming an opinion of their own, and pin their faith upon the decisions -- or rather the practice, of the amateurs. || must make the best selections; they therefore forego the trouble of forming an opinion of their own, and pin their faith upon the decisions -- or rather the practice, of the amateurs. || must make the best selections; they therefore forego the trouble of forming an opinion of their own, and pin their faith upon the decisions -- or rather the practice, of the amateurs. || must make the best selections; they therefore forego the trouble of forming an opinion of their own, and pin their faith upon the decisions -- or rather the practice, of the amateurs. || must make the best selections; they therefore forego the trouble of forming an opinion of their own, and pin their faith upon the decisions -- or rather the practice, of the amateurs. || must make the best selections; they therefore forego the trouble of forming an opinion of their own, and pin their faith upon the decisions -- or rather the practice, of the amateurs. || must make the best selections; they therefore forego the trouble of forming an opinion of their own, and pin their faith upon the decisions -- or rather the practice, of the amateurs. || must make the best selections; they therefore forego the trouble of forming an opinion of their own, and pin their faith upon the decisions -- or rather the practice, of the amateurs. || must make the best selections; they therefore forego the trouble of forming an opinion of their own, and pin their faith upon the decisions -- or rather the practice, of the amateurs. || must make the best selections; they therefore forego the trouble of forming an opinion of their own, and pin their faith upon the decisions -- or rather the practice, of the amateurs. || must make the best selections; they therefore forego the trouble of forming an opinion of their own, and pin their faith upon the decisions -- or rather the practice, of the amateurs. || must make the best selections; they therefore forego the trouble of forming an opinion of their own, and pin their faith upon the decisions -- or rather the practice, of the amateurs. || must make the best selections; they therefore forego the trouble of forming an opinion of their own, and pin their faith upon the decisions -- or rather the practice, of the amateurs."
pin_fic_1854_2820.txt-324-38_pinned_fic_1970_10535.txt-192-2,4 Identical 2 Distantly Related 2 Distantly Related 3 Closely Related,"at that booby, Bill Jeffrey, for the girls to laugh at, nor to draw any more pictures on her slate of the Dame Sobriety, as she called Julia, and lastly, not to pin any more chalk rags on the boys ' coats. || at that booby, Bill Jeffrey, for the girls to laugh at, nor to draw any more pictures on her slate of the Dame Sobriety, as she called Julia, and lastly, not to pin any more chalk rags on the boys ' coats. || at that booby, Bill Jeffrey, for the girls to laugh at, nor to draw any more pictures on her slate of the Dame Sobriety, as she called Julia, and lastly, not to pin any more chalk rags on the boys ' coats. || at that booby, Bill Jeffrey, for the girls to laugh at, nor to draw any more pictures on her slate of the Dame Sobriety, as she called Julia, and lastly, not to pin any more chalk rags on the boys ' coats. || at that booby, Bill Jeffrey, for the girls to laugh at, nor to draw any more pictures on her slate of the Dame Sobriety, as she called Julia, and lastly, not to pin any more chalk rags on the boys ' coats. || at that booby, Bill Jeffrey, for the girls to laugh at, nor to draw any more pictures on her slate of the Dame Sobriety, as she called Julia, and lastly, not to pin any more chalk rags on the boys ' coats. || at that booby, Bill Jeffrey, for the girls to laugh at, nor to draw any more pictures on her slate of the Dame Sobriety, as she called Julia, and lastly, not to pin any more chalk rags on the boys ' coats. || at that booby, Bill Jeffrey, for the girls to laugh at, nor to draw any more pictures on her slate of the Dame Sobriety, as she called Julia, and lastly, not to pin any more chalk rags on the boys ' coats."
pin_fic_1965_780079.txt-2466-36_pinned_fic_1853_2454.txt-536-44,3 Closely Related,"Why, this refractory young individual couldn't be persuaded to walk towards home in any other way, when they had him out for an airing, and what does this old friend of mine do, but allow a handkerchief to be pinned to his coat-tail, and go prancing along the street like a horse for the spoiled brat to drive. || Why, this refractory young individual couldn't be persuaded to walk towards home in any other way, when they had him out for an airing, and what does this old friend of mine do, but allow a handkerchief to be pinned to his coat-tail, and go prancing along the street like a horse for the spoiled brat to drive."
pin_fic_1971_780008.txt-1358-26_pin_fic_2009_36905.txt-225-7,2 Distantly Related,But the man himself was impossible to pin down. || But the man himself was impossible to pin down.
pin_fic_1971_780008.txt-1358-26_pin_fic_2009_36905.txt-225-7,2 Distantly Related,"My eyes, adjusting to the very faint light emitted from the frame, showed that rocks had been pounded in about the large box to pin it in place. || My eyes, adjusting to the very faint light emitted from the frame, showed that rocks had been pounded in about the large box to pin it in place."
pin_fic_1975_780112.txt-3849-5_pinned_fic_1858_9768.txt-4185-16,2 Distantly Related 3 Closely Related 2 Distantly Related 2 Distantly Related 2 Distantly Related,"Every time he tried to pin the thought into position, to guide it into focus, it slipped away, eluding him. || Every time he tried to pin the thought into position, to guide it into focus, it slipped away, eluding him. || Every time he tried to pin the thought into position, to guide it into focus, it slipped away, eluding him. || Every time he tried to pin the thought into position, to guide it into focus, it slipped away, eluding him. || Every time he tried to pin the thought into position, to guide it into focus, it slipped away, eluding him. || Every time he tried to pin the thought into position, to guide it into focus, it slipped away, eluding him. || Every time he tried to pin the thought into position, to guide it into focus, it slipped away, eluding him. || Every time he tried to pin the thought into position, to guide it into focus, it slipped away, eluding him. || Every time he tried to pin the thought into position, to guide it into focus, it slipped away, eluding him. || Every time he tried to pin the thought into position, to guide it into focus, it slipped away, eluding him."
pin_fic_1975_780112.txt-3849-5_pinned_fic_1858_9768.txt-4185-16,2 Distantly Related 4 Identical 3 Closely Related 2 Distantly Related 2 Distantly Related,"With that he came in (' t was a little dark, with the shawl pinned at the windy): -- Don't go too near her face, for fear her breath's infractious, ' sis I. I didn't bring a light, sir, ' sis I. || With that he came in (' t was a little dark, with the shawl pinned at the windy): -- Don't go too near her face, for fear her breath's infractious, ' sis I. I didn't bring a light, sir, ' sis I. || With that he came in (' t was a little dark, with the shawl pinned at the windy): -- Don't go too near her face, for fear her breath's infractious, ' sis I. I didn't bring a light, sir, ' sis I. || With that he came in (' t was a little dark, with the shawl pinned at the windy): -- Don't go too near her face, for fear her breath's infractious, ' sis I. I didn't bring a light, sir, ' sis I. || With that he came in (' t was a little dark, with the shawl pinned at the windy): -- Don't go too near her face, for fear her breath's infractious, ' sis I. I didn't bring a light, sir, ' sis I. || With that he came in (' t was a little dark, with the shawl pinned at the windy): -- Don't go too near her face, for fear her breath's infractious, ' sis I. I didn't bring a light, sir, ' sis I. || With that he came in (' t was a little dark, with the shawl pinned at the windy): -- Don't go too near her face, for fear her breath's infractious, ' sis I. I didn't bring a light, sir, ' sis I. || With that he came in (' t was a little dark, with the shawl pinned at the windy): -- Don't go too near her face, for fear her breath's infractious, ' sis I. I didn't bring a light, sir, ' sis I. || With that he came in (' t was a little dark, with the shawl pinned at the windy): -- Don't go too near her face, for fear her breath's infractious, ' sis I. I didn't bring a light, sir, ' sis I. || With that he came in (' t was a little dark, with the shawl pinned at the windy): -- Don't go too near her face, for fear her breath's infractious, ' sis I. I didn't bring a light, sir, ' sis I."
pin_fic_1994_41224.txt-342-44_Pin_fic_1824_7277.txt-354-0,2 Distantly Related,"Pin down the undersheet all around as grandmamma has hers; I feel fidgetty to-night, and a wrinkle would disturb me -- heigho! || Pin down the undersheet all around as grandmamma has hers; I feel fidgetty to-night, and a wrinkle would disturb me -- heigho!"
pin_mag_1843_555150.txt-441-20_pinned_fic_1970_10523.txt-941-6,2 Distantly Related,"She brushed her hair quickly and pinned it, reached for a purse on the bureau, then left it there, putting her house keys in her pocket. || She brushed her hair quickly and pinned it, reached for a purse on the bureau, then left it there, putting her house keys in her pocket."
pin_mag_1843_555150.txt-441-20_pinning_fic_1822_7275.txt-189-74,2 Distantly Related 2 Distantly Related 2 Distantly Related 2 Distantly Related 2 Distantly Related,"The feather that adorns the royal bird, supports his flight; strip him of his plumage, and you pin him to the earth. "" || The feather that adorns the royal bird, supports his flight; strip him of his plumage, and you pin him to the earth. "" || The feather that adorns the royal bird, supports his flight; strip him of his plumage, and you pin him to the earth. "" || The feather that adorns the royal bird, supports his flight; strip him of his plumage, and you pin him to the earth. "" || The feather that adorns the royal bird, supports his flight; strip him of his plumage, and you pin him to the earth. "" || The feather that adorns the royal bird, supports his flight; strip him of his plumage, and you pin him to the earth. "" || The feather that adorns the royal bird, supports his flight; strip him of his plumage, and you pin him to the earth. "" || The feather that adorns the royal bird, supports his flight; strip him of his plumage, and you pin him to the earth. "" || The feather that adorns the royal bird, supports his flight; strip him of his plumage, and you pin him to the earth. "" || The feather that adorns the royal bird, supports his flight; strip him of his plumage, and you pin him to the earth. """
pin_mag_1964_244708.txt-26-29_pinning_fic_2001_46318.txt-348-2,2 Distantly Related,"She was pinning it in place when her gaze in the mirror caught Lisa's. "" || She was pinning it in place when her gaze in the mirror caught Lisa's. """
pin_mag_1964_244708.txt-26-29_pinning_fic_2001_46318.txt-348-2,2 Distantly Related,"To prosecute an employer, the Federal Government would have to prove that his refusal to hire a Negro was "" willful "" - often a tough matter to pin down in court. || To prosecute an employer, the Federal Government would have to prove that his refusal to hire a Negro was "" willful "" - often a tough matter to pin down in court."
pin_mag_1968_478849.txt-47-13_pinned_fic_1834_7012.txt-2400-67,2 Distantly Related 2 Distantly Related 2 Distantly Related 2 Distantly Related,"It had caught, as if by providential direction, in the very chaos of combat, the figure that had sent forth the cry of affliction; and as he bestrid the body of Abdalla, and caught up the childish minstrel from his person, he shivered with a single stroke of his sabre, the spear that, in a moment, would have pinned to the earth both father and son. "" || It had caught, as if by providential direction, in the very chaos of combat, the figure that had sent forth the cry of affliction; and as he bestrid the body of Abdalla, and caught up the childish minstrel from his person, he shivered with a single stroke of his sabre, the spear that, in a moment, would have pinned to the earth both father and son. "" || It had caught, as if by providential direction, in the very chaos of combat, the figure that had sent forth the cry of affliction; and as he bestrid the body of Abdalla, and caught up the childish minstrel from his person, he shivered with a single stroke of his sabre, the spear that, in a moment, would have pinned to the earth both father and son. "" || It had caught, as if by providential direction, in the very chaos of combat, the figure that had sent forth the cry of affliction; and as he bestrid the body of Abdalla, and caught up the childish minstrel from his person, he shivered with a single stroke of his sabre, the spear that, in a moment, would have pinned to the earth both father and son. "" || It had caught, as if by providential direction, in the very chaos of combat, the figure that had sent forth the cry of affliction; and as he bestrid the body of Abdalla, and caught up the childish minstrel from his person, he shivered with a single stroke of his sabre, the spear that, in a moment, would have pinned to the earth both father and son. "" || It had caught, as if by providential direction, in the very chaos of combat, the figure that had sent forth the cry of affliction; and as he bestrid the body of Abdalla, and caught up the childish minstrel from his person, he shivered with a single stroke of his sabre, the spear that, in a moment, would have pinned to the earth both father and son. "" || It had caught, as if by providential direction, in the very chaos of combat, the figure that had sent forth the cry of affliction; and as he bestrid the body of Abdalla, and caught up the childish minstrel from his person, he shivered with a single stroke of his sabre, the spear that, in a moment, would have pinned to the earth both father and son. "" || It had caught, as if by providential direction, in the very chaos of combat, the figure that had sent forth the cry of affliction; and as he bestrid the body of Abdalla, and caught up the childish minstrel from his person, he shivered with a single stroke of his sabre, the spear that, in a moment, would have pinned to the earth both father and son. """
pin_mag_1968_478849.txt-47-13_pinned_fic_1834_7012.txt-2400-67,2 Distantly Related 2 Distantly Related 2 Distantly Related 2 Distantly Related 2 Distantly Related 2 Distantly Related 2 Distantly Related,"As Detroit's ghetto burned our President went on national television more to pin blame on poor old Governor Romney than to inspire or offer solutions, (Never saying, of course, that he had recently rejected a private proposal by New York's Governor Nelson Rockefeller to call a national conference on ghetto problems.) || As Detroit's ghetto burned our President went on national television more to pin blame on poor old Governor Romney than to inspire or offer solutions, (Never saying, of course, that he had recently rejected a private proposal by New York's Governor Nelson Rockefeller to call a national conference on ghetto problems.) || As Detroit's ghetto burned our President went on national television more to pin blame on poor old Governor Romney than to inspire or offer solutions, (Never saying, of course, that he had recently rejected a private proposal by New York's Governor Nelson Rockefeller to call a national conference on ghetto problems.) || As Detroit's ghetto burned our President went on national television more to pin blame on poor old Governor Romney than to inspire or offer solutions, (Never saying, of course, that he had recently rejected a private proposal by New York's Governor Nelson Rockefeller to call a national conference on ghetto problems.) || As Detroit's ghetto burned our President went on national television more to pin blame on poor old Governor Romney than to inspire or offer solutions, (Never saying, of course, that he had recently rejected a private proposal by New York's Governor Nelson Rockefeller to call a national conference on ghetto problems.) || As Detroit's ghetto burned our President went on national television more to pin blame on poor old Governor Romney than to inspire or offer solutions, (Never saying, of course, that he had recently rejected a private proposal by New York's Governor Nelson Rockefeller to call a national conference on ghetto problems.) || As Detroit's ghetto burned our President went on national television more to pin blame on poor old Governor Romney than to inspire or offer solutions, (Never saying, of course, that he had recently rejected a private proposal by New York's Governor Nelson Rockefeller to call a national conference on ghetto problems.) || As Detroit's ghetto burned our President went on national television more to pin blame on poor old Governor Romney than to inspire or offer solutions, (Never saying, of course, that he had recently rejected a private proposal by New York's Governor Nelson Rockefeller to call a national conference on ghetto problems.) || As Detroit's ghetto burned our President went on national television more to pin blame on poor old Governor Romney than to inspire or offer solutions, (Never saying, of course, that he had recently rejected a private proposal by New York's Governor Nelson Rockefeller to call a national conference on ghetto problems.) || As Detroit's ghetto burned our President went on national television more to pin blame on poor old Governor Romney than to inspire or offer solutions, (Never saying, of course, that he had recently rejected a private proposal by New York's Governor Nelson Rockefeller to call a national conference on ghetto problems.) || As Detroit's ghetto burned our President went on national television more to pin blame on poor old Governor Romney than to inspire or offer solutions, (Never saying, of course, that he had recently rejected a private proposal by New York's Governor Nelson Rockefeller to call a national conference on ghetto problems.) || As Detroit's ghetto burned our President went on national television more to pin blame on poor old Governor Romney than to inspire or offer solutions, (Never saying, of course, that he had recently rejected a private proposal by New York's Governor Nelson Rockefeller to call a national conference on ghetto problems.) || As Detroit's ghetto burned our President went on national television more to pin blame on poor old Governor Romney than to inspire or offer solutions, (Never saying, of course, that he had recently rejected a private proposal by New York's Governor Nelson Rockefeller to call a national conference on ghetto problems.) || As Detroit's ghetto burned our President went on national television more to pin blame on poor old Governor Romney than to inspire or offer solutions, (Never saying, of course, that he had recently rejected a private proposal by New York's Governor Nelson Rockefeller to call a national conference on ghetto problems.)"
pin_mag_1968_478849.txt-47-13_pinned_nf_1849_748465.txt-436-4,2 Distantly Related,"It should then be pinned on a board, the moist side downwards, so that two of its edges -- the right and lower ones -- project a little over those of the board. || It should then be pinned on a board, the moist side downwards, so that two of its edges -- the right and lower ones -- project a little over those of the board."
pin_mag_1978_292549.txt-8-5_pin_fic_1987_10752.txt-1623-6,4 Identical 2 Distantly Related 2 Distantly Related,"For reasons he couldn't altogether pin down, he still disliked Quantrill and always would. || For reasons he couldn't altogether pin down, he still disliked Quantrill and always would. || For reasons he couldn't altogether pin down, he still disliked Quantrill and always would. || For reasons he couldn't altogether pin down, he still disliked Quantrill and always would. || For reasons he couldn't altogether pin down, he still disliked Quantrill and always would. || For reasons he couldn't altogether pin down, he still disliked Quantrill and always would."
pin_mag_1999_361704.txt-0-20_pinned_fic_1966_1008.txt-2519-23,2 Distantly Related,"@@361704 If I had to explain the bottomless public fascination with the story of the Titanic, I wouldn't pin it on the idea that the sunken ship represented a moral tale of hubris or of careless luxury but rather on the fact that it was both a magnificent and flawed piece of work, and that it became most interesting when it was lying out of reach underwater. || @@361704 If I had to explain the bottomless public fascination with the story of the Titanic, I wouldn't pin it on the idea that the sunken ship represented a moral tale of hubris or of careless luxury but rather on the fact that it was both a magnificent and flawed piece of work, and that it became most interesting when it was lying out of reach underwater."
