annotation_lbl,categories,sentences
Circle_fic_2007_52477.txt-270-44_circled_fic_1993_1040095.txt-1060-4,2 Distantly Related 2 Distantly Related 2 Distantly Related,"Author Affiliation LEE SMITH is the author of three story collections and twelve novels, including Oral History (1983), Fair and Tender Ladies (1988), and The Last Girls (2002), cowinner of the Southern Book Critics Circle Award for Fiction. || Author Affiliation LEE SMITH is the author of three story collections and twelve novels, including Oral History (1983), Fair and Tender Ladies (1988), and The Last Girls (2002), cowinner of the Southern Book Critics Circle Award for Fiction. || Author Affiliation LEE SMITH is the author of three story collections and twelve novels, including Oral History (1983), Fair and Tender Ladies (1988), and The Last Girls (2002), cowinner of the Southern Book Critics Circle Award for Fiction. || Author Affiliation LEE SMITH is the author of three story collections and twelve novels, including Oral History (1983), Fair and Tender Ladies (1988), and The Last Girls (2002), cowinner of the Southern Book Critics Circle Award for Fiction. || Author Affiliation LEE SMITH is the author of three story collections and twelve novels, including Oral History (1983), Fair and Tender Ladies (1988), and The Last Girls (2002), cowinner of the Southern Book Critics Circle Award for Fiction. || Author Affiliation LEE SMITH is the author of three story collections and twelve novels, including Oral History (1983), Fair and Tender Ladies (1988), and The Last Girls (2002), cowinner of the Southern Book Critics Circle Award for Fiction."
Circled_fic_1811_8637.txt-163-27_circling_nf_1855_748479.txt-213-16,2 Distantly Related 2 Distantly Related 2 Distantly Related 3 Closely Related,"The Egyptians, like the Americans, were a mixed race, with some Negro blood circling around the throne, as well as in the mud hovels. || The Egyptians, like the Americans, were a mixed race, with some Negro blood circling around the throne, as well as in the mud hovels. || The Egyptians, like the Americans, were a mixed race, with some Negro blood circling around the throne, as well as in the mud hovels. || The Egyptians, like the Americans, were a mixed race, with some Negro blood circling around the throne, as well as in the mud hovels. || The Egyptians, like the Americans, were a mixed race, with some Negro blood circling around the throne, as well as in the mud hovels. || The Egyptians, like the Americans, were a mixed race, with some Negro blood circling around the throne, as well as in the mud hovels. || The Egyptians, like the Americans, were a mixed race, with some Negro blood circling around the throne, as well as in the mud hovels. || The Egyptians, like the Americans, were a mixed race, with some Negro blood circling around the throne, as well as in the mud hovels."
Circled_fic_1837_8687.txt-961-1_circling_fic_1849_7230.txt-2441-6,2 Distantly Related 3 Closely Related 2 Distantly Related,"Euphas Circled with Christian swords, Stands waiting thy behest! || Euphas Circled with Christian swords, Stands waiting thy behest! || Euphas Circled with Christian swords, Stands waiting thy behest! || Euphas Circled with Christian swords, Stands waiting thy behest! || Euphas Circled with Christian swords, Stands waiting thy behest! || Euphas Circled with Christian swords, Stands waiting thy behest!"
Circled_mag_1840_554815.txt-207-38_circled_mag_1840_554815.txt-255-35,3 Closely Related 2 Distantly Related 2 Distantly Related,"A woman in distress affects most minds more strongly than a suffering angel; and this scene of purely human character served as a pretty touchstone, to try the sympathies of the many who circled the gallery. || A woman in distress affects most minds more strongly than a suffering angel; and this scene of purely human character served as a pretty touchstone, to try the sympathies of the many who circled the gallery. || A woman in distress affects most minds more strongly than a suffering angel; and this scene of purely human character served as a pretty touchstone, to try the sympathies of the many who circled the gallery. || A woman in distress affects most minds more strongly than a suffering angel; and this scene of purely human character served as a pretty touchstone, to try the sympathies of the many who circled the gallery. || A woman in distress affects most minds more strongly than a suffering angel; and this scene of purely human character served as a pretty touchstone, to try the sympathies of the many who circled the gallery. || A woman in distress affects most minds more strongly than a suffering angel; and this scene of purely human character served as a pretty touchstone, to try the sympathies of the many who circled the gallery."
Circling_fic_1961_10405.txt-1211-0_circling_nf_1849_749269.txt-626-4,2 Distantly Related,"Circling the city, indeed its primary vein of extra-human, by day it thrust the streets back upon their own mortality, miserable or effete. || Circling the city, indeed its primary vein of extra-human, by day it thrust the streets back upon their own mortality, miserable or effete."
Circling_mag_2002_410849.txt-34-0_circle_fic_1833_7028.txt-1089-12,2 Distantly Related,Circling the globe in slightly different orbits 15 times a || Circling the globe in slightly different orbits 15 times a
Pinning_mag_1970_282090.txt-31-0_pin_fic_2001_29262.txt-63-3,4 Identical,"He couldn't pin down a definite number, but he knew it was going to be a || He couldn't pin down a definite number, but he knew it was going to be a"
circle_fic_1833_7028.txt-1089-12_Circled_fic_1811_8637.txt-163-27,2 Distantly Related 2 Distantly Related 2 Distantly Related 2 Distantly Related 2 Distantly Related 2 Distantly Related 2 Distantly Related 2 Distantly Related,Acquirement thus made will feed itself: circle will be added to circle by the strengthening impulse of gratified curiosity: the conformity to nature will make the acquisition more substantial and the || Acquirement thus made will feed itself: circle will be added to circle by the strengthening impulse of gratified curiosity: the conformity to nature will make the acquisition more substantial and the || Acquirement thus made will feed itself: circle will be added to circle by the strengthening impulse of gratified curiosity: the conformity to nature will make the acquisition more substantial and the || Acquirement thus made will feed itself: circle will be added to circle by the strengthening impulse of gratified curiosity: the conformity to nature will make the acquisition more substantial and the || Acquirement thus made will feed itself: circle will be added to circle by the strengthening impulse of gratified curiosity: the conformity to nature will make the acquisition more substantial and the || Acquirement thus made will feed itself: circle will be added to circle by the strengthening impulse of gratified curiosity: the conformity to nature will make the acquisition more substantial and the || Acquirement thus made will feed itself: circle will be added to circle by the strengthening impulse of gratified curiosity: the conformity to nature will make the acquisition more substantial and the || Acquirement thus made will feed itself: circle will be added to circle by the strengthening impulse of gratified curiosity: the conformity to nature will make the acquisition more substantial and the || Acquirement thus made will feed itself: circle will be added to circle by the strengthening impulse of gratified curiosity: the conformity to nature will make the acquisition more substantial and the || Acquirement thus made will feed itself: circle will be added to circle by the strengthening impulse of gratified curiosity: the conformity to nature will make the acquisition more substantial and the || Acquirement thus made will feed itself: circle will be added to circle by the strengthening impulse of gratified curiosity: the conformity to nature will make the acquisition more substantial and the || Acquirement thus made will feed itself: circle will be added to circle by the strengthening impulse of gratified curiosity: the conformity to nature will make the acquisition more substantial and the || Acquirement thus made will feed itself: circle will be added to circle by the strengthening impulse of gratified curiosity: the conformity to nature will make the acquisition more substantial and the || Acquirement thus made will feed itself: circle will be added to circle by the strengthening impulse of gratified curiosity: the conformity to nature will make the acquisition more substantial and the || Acquirement thus made will feed itself: circle will be added to circle by the strengthening impulse of gratified curiosity: the conformity to nature will make the acquisition more substantial and the || Acquirement thus made will feed itself: circle will be added to circle by the strengthening impulse of gratified curiosity: the conformity to nature will make the acquisition more substantial and the
circle_fic_1839_8627.txt-1994-11_circled_news_1982_668315.txt-45-12,2 Distantly Related,"See how they bear him up upon their wings, And circle him with glory! || See how they bear him up upon their wings, And circle him with glory!"
circle_fic_1839_8627.txt-1994-11_circled_news_1982_668315.txt-45-12,2 Distantly Related 2 Distantly Related 2 Distantly Related,A Montana pass to Earl Cooper picked up 5 more before Solomon circled left end on a wide receiver reverse for 14 more. || A Montana pass to Earl Cooper picked up 5 more before Solomon circled left end on a wide receiver reverse for 14 more. || A Montana pass to Earl Cooper picked up 5 more before Solomon circled left end on a wide receiver reverse for 14 more. || A Montana pass to Earl Cooper picked up 5 more before Solomon circled left end on a wide receiver reverse for 14 more. || A Montana pass to Earl Cooper picked up 5 more before Solomon circled left end on a wide receiver reverse for 14 more. || A Montana pass to Earl Cooper picked up 5 more before Solomon circled left end on a wide receiver reverse for 14 more.
circle_fic_1854_70.txt-3413-2_circled_fic_1973_10569.txt-2907-9,3 Closely Related,"Thus they circle until they fall upon the recent trail of a fox, for a wise hound will forsake everything else for this. || Thus they circle until they fall upon the recent trail of a fox, for a wise hound will forsake everything else for this."
circle_fic_1854_70.txt-3413-2_circled_fic_1973_10569.txt-2907-9,3 Closely Related 2 Distantly Related,A new concrete road ran up to it and circled it to rejoin itself and fade away into the dun thistle-strewn hills. || A new concrete road ran up to it and circled it to rejoin itself and fade away into the dun thistle-strewn hills. || A new concrete road ran up to it and circled it to rejoin itself and fade away into the dun thistle-strewn hills. || A new concrete road ran up to it and circled it to rejoin itself and fade away into the dun thistle-strewn hills.
circle_fic_2007_52345.txt-225-12_circling_nf_1849_749269.txt-626-4,3 Closely Related 2 Distantly Related 2 Distantly Related 2 Distantly Related 2 Distantly Related 2 Distantly Related 2 Distantly Related 2 Distantly Related 2 Distantly Related 2 Distantly Related 2 Distantly Related 2 Distantly Related,"he said again, circling back to his favorite maxim. || he said again, circling back to his favorite maxim. || he said again, circling back to his favorite maxim. || he said again, circling back to his favorite maxim. || he said again, circling back to his favorite maxim. || he said again, circling back to his favorite maxim. || he said again, circling back to his favorite maxim. || he said again, circling back to his favorite maxim. || he said again, circling back to his favorite maxim. || he said again, circling back to his favorite maxim. || he said again, circling back to his favorite maxim. || he said again, circling back to his favorite maxim. || he said again, circling back to his favorite maxim. || he said again, circling back to his favorite maxim. || he said again, circling back to his favorite maxim. || he said again, circling back to his favorite maxim. || he said again, circling back to his favorite maxim. || he said again, circling back to his favorite maxim. || he said again, circling back to his favorite maxim. || he said again, circling back to his favorite maxim. || he said again, circling back to his favorite maxim. || he said again, circling back to his favorite maxim. || he said again, circling back to his favorite maxim. || he said again, circling back to his favorite maxim."
circle_mag_1992_409433.txt-83-9_circling_fic_1849_7230.txt-2441-6,3 Closely Related,"Once out of sight, the buck angled to circle around me. || Once out of sight, the buck angled to circle around me."
circle_mag_2004_411260.txt-45-13_circle_fic_1986_782032.txt-1834-19,4 Identical 2 Distantly Related 2 Distantly Related 3 Closely Related 2 Distantly Related,"Instantly, a crewman flipped a switch to deploy a smoke marker and the aircraft turned hard right to circle back on the contact point. "" || Instantly, a crewman flipped a switch to deploy a smoke marker and the aircraft turned hard right to circle back on the contact point. "" || Instantly, a crewman flipped a switch to deploy a smoke marker and the aircraft turned hard right to circle back on the contact point. "" || Instantly, a crewman flipped a switch to deploy a smoke marker and the aircraft turned hard right to circle back on the contact point. "" || Instantly, a crewman flipped a switch to deploy a smoke marker and the aircraft turned hard right to circle back on the contact point. "" || Instantly, a crewman flipped a switch to deploy a smoke marker and the aircraft turned hard right to circle back on the contact point. "" || Instantly, a crewman flipped a switch to deploy a smoke marker and the aircraft turned hard right to circle back on the contact point. "" || Instantly, a crewman flipped a switch to deploy a smoke marker and the aircraft turned hard right to circle back on the contact point. "" || Instantly, a crewman flipped a switch to deploy a smoke marker and the aircraft turned hard right to circle back on the contact point. "" || Instantly, a crewman flipped a switch to deploy a smoke marker and the aircraft turned hard right to circle back on the contact point. """
circle_mag_2004_411260.txt-45-13_circle_fic_1986_782032.txt-1834-19,4 Identical 3 Closely Related,"When you lose a track, make a swing to one side and circle out in front. || When you lose a track, make a swing to one side and circle out in front. || When you lose a track, make a swing to one side and circle out in front. || When you lose a track, make a swing to one side and circle out in front."
circle_nf_1827_747521.txt-163-33_Circled_mag_1840_554815.txt-207-38,2 Distantly Related 2 Distantly Related 2 Distantly Related 2 Distantly Related,"Let 6/, be the central hne; divide it into four parts, and at one fourth make the hne a b across the column; on c, make the half circle a e b; with the distance / 1, at the neck of the column, and on 1, on the central hne, make the points 1, 1, on the circle; divide from 1 to c, || Let 6/, be the central hne; divide it into four parts, and at one fourth make the hne a b across the column; on c, make the half circle a e b; with the distance / 1, at the neck of the column, and on 1, on the central hne, make the points 1, 1, on the circle; divide from 1 to c, || Let 6/, be the central hne; divide it into four parts, and at one fourth make the hne a b across the column; on c, make the half circle a e b; with the distance / 1, at the neck of the column, and on 1, on the central hne, make the points 1, 1, on the circle; divide from 1 to c, || Let 6/, be the central hne; divide it into four parts, and at one fourth make the hne a b across the column; on c, make the half circle a e b; with the distance / 1, at the neck of the column, and on 1, on the central hne, make the points 1, 1, on the circle; divide from 1 to c, || Let 6/, be the central hne; divide it into four parts, and at one fourth make the hne a b across the column; on c, make the half circle a e b; with the distance / 1, at the neck of the column, and on 1, on the central hne, make the points 1, 1, on the circle; divide from 1 to c, || Let 6/, be the central hne; divide it into four parts, and at one fourth make the hne a b across the column; on c, make the half circle a e b; with the distance / 1, at the neck of the column, and on 1, on the central hne, make the points 1, 1, on the circle; divide from 1 to c, || Let 6/, be the central hne; divide it into four parts, and at one fourth make the hne a b across the column; on c, make the half circle a e b; with the distance / 1, at the neck of the column, and on 1, on the central hne, make the points 1, 1, on the circle; divide from 1 to c, || Let 6/, be the central hne; divide it into four parts, and at one fourth make the hne a b across the column; on c, make the half circle a e b; with the distance / 1, at the neck of the column, and on 1, on the central hne, make the points 1, 1, on the circle; divide from 1 to c,"
circle_nf_1827_747521.txt-163-33_circled_nf_1844_747892.txt-1058-25,2 Distantly Related 3 Closely Related 3 Closely Related 2 Distantly Related,"Edouard Jess has been a favourite with us these two years, and is still admired for the beautiful flowers, of a bright red circled by a pale tint, delightfully fragrant. || Edouard Jess has been a favourite with us these two years, and is still admired for the beautiful flowers, of a bright red circled by a pale tint, delightfully fragrant. || Edouard Jess has been a favourite with us these two years, and is still admired for the beautiful flowers, of a bright red circled by a pale tint, delightfully fragrant. || Edouard Jess has been a favourite with us these two years, and is still admired for the beautiful flowers, of a bright red circled by a pale tint, delightfully fragrant. || Edouard Jess has been a favourite with us these two years, and is still admired for the beautiful flowers, of a bright red circled by a pale tint, delightfully fragrant. || Edouard Jess has been a favourite with us these two years, and is still admired for the beautiful flowers, of a bright red circled by a pale tint, delightfully fragrant. || Edouard Jess has been a favourite with us these two years, and is still admired for the beautiful flowers, of a bright red circled by a pale tint, delightfully fragrant. || Edouard Jess has been a favourite with us these two years, and is still admired for the beautiful flowers, of a bright red circled by a pale tint, delightfully fragrant."
circled_fic_1833_7059.txt-360-2_circled_fic_1852_593.txt-1202-17,2 Distantly Related 3 Closely Related,"Those pleasantly swelling slopes of our farm, descending towards the wide meadows, through which sluggishly circled the brimful tide of the Charles, bathing the long sedges on its hither and farther shores; the broad, sunny gleam over the winding water; that peculiar picturesqueness of the scene where capes and headlands put themselves boldly forth upon the perfect level of the || Those pleasantly swelling slopes of our farm, descending towards the wide meadows, through which sluggishly circled the brimful tide of the Charles, bathing the long sedges on its hither and farther shores; the broad, sunny gleam over the winding water; that peculiar picturesqueness of the scene where capes and headlands put themselves boldly forth upon the perfect level of the || Those pleasantly swelling slopes of our farm, descending towards the wide meadows, through which sluggishly circled the brimful tide of the Charles, bathing the long sedges on its hither and farther shores; the broad, sunny gleam over the winding water; that peculiar picturesqueness of the scene where capes and headlands put themselves boldly forth upon the perfect level of the || Those pleasantly swelling slopes of our farm, descending towards the wide meadows, through which sluggishly circled the brimful tide of the Charles, bathing the long sedges on its hither and farther shores; the broad, sunny gleam over the winding water; that peculiar picturesqueness of the scene where capes and headlands put themselves boldly forth upon the perfect level of the"
circled_fic_1833_7059.txt-360-2_circled_fic_1852_593.txt-1202-17,2 Distantly Related 3 Closely Related 3 Closely Related,"The wine circled gaily, and the song and jest passed merrily round. || The wine circled gaily, and the song and jest passed merrily round. || The wine circled gaily, and the song and jest passed merrily round. || The wine circled gaily, and the song and jest passed merrily round. || The wine circled gaily, and the song and jest passed merrily round. || The wine circled gaily, and the song and jest passed merrily round."
circled_fic_1839_7049.txt-872-28_circling_fic_1849_7230.txt-2441-6,2 Distantly Related,"The officer bowed and retired, and soon after, the men were seen taking down their boarding-pikes from the masts and booms, with which they were circled, and their basket-handled swords, which were stuck round the capstan and long-boat, and their short, broad daggers, resembling the bowie-knife; and these they proceeded to grind and polish, preparations dismal enough for their end, but engaged in with the more alacrity by the men, for the grog they had just drunk || The officer bowed and retired, and soon after, the men were seen taking down their boarding-pikes from the masts and booms, with which they were circled, and their basket-handled swords, which were stuck round the capstan and long-boat, and their short, broad daggers, resembling the bowie-knife; and these they proceeded to grind and polish, preparations dismal enough for their end, but engaged in with the more alacrity by the men, for the grog they had just drunk"
circled_fic_1840_7164.txt-175-23_circling_fic_1979_10656.txt-791-8,2 Distantly Related,And so Tonweya omitted the story of his circling these pte and he left out any mention of the grasshopper who pointed out the proper ridge. || And so Tonweya omitted the story of his circling these pte and he left out any mention of the grasshopper who pointed out the proper ridge.
circled_fic_1840_7164.txt-175-23_circling_fic_1979_10656.txt-791-8,2 Distantly Related 2 Distantly Related 2 Distantly Related,"The alders are separated more widely from each other, and grow more in scattered clumps, which sometimes form green islets, circled with a fringe of scarlet, wherever their red roots are washed and polished by the flowing waters. || The alders are separated more widely from each other, and grow more in scattered clumps, which sometimes form green islets, circled with a fringe of scarlet, wherever their red roots are washed and polished by the flowing waters. || The alders are separated more widely from each other, and grow more in scattered clumps, which sometimes form green islets, circled with a fringe of scarlet, wherever their red roots are washed and polished by the flowing waters. || The alders are separated more widely from each other, and grow more in scattered clumps, which sometimes form green islets, circled with a fringe of scarlet, wherever their red roots are washed and polished by the flowing waters. || The alders are separated more widely from each other, and grow more in scattered clumps, which sometimes form green islets, circled with a fringe of scarlet, wherever their red roots are washed and polished by the flowing waters. || The alders are separated more widely from each other, and grow more in scattered clumps, which sometimes form green islets, circled with a fringe of scarlet, wherever their red roots are washed and polished by the flowing waters."
circled_fic_1846_544.txt-2230-13_circling_nf_1849_749269.txt-626-4,2 Distantly Related,"The strong trade wind, met in its course by these elevations, circled and eddied about their summits, and was sometimes driven down the steep ravine and swept across the || The strong trade wind, met in its course by these elevations, circled and eddied about their summits, and was sometimes driven down the steep ravine and swept across the"
circled_fic_1851_746.txt-7466-23_circling_fic_1849_7230.txt-2441-6,2 Distantly Related,"As we glided nearer, the stranger showed French colours from his peak; and by the eddying cloud of vulture sea-fowl that circled, and hovered, and swooped around him, it was plain that the whale alongside must be what the fishermen call a blasted whale, that is, a whale that has died unmolested on the sea, and so floated an unappropriated corpse. || As we glided nearer, the stranger showed French colours from his peak; and by the eddying cloud of vulture sea-fowl that circled, and hovered, and swooped around him, it was plain that the whale alongside must be what the fishermen call a blasted whale, that is, a whale that has died unmolested on the sea, and so floated an unappropriated corpse."
circled_fic_1852_593.txt-1202-17_circle_fic_1978_10636.txt-27091-12,3 Closely Related,"There is a sense of awe among the others, as they circle a live American. || There is a sense of awe among the others, as they circle a live American."
circled_fic_1853_7455.txt-645-20_circled_nf_1844_747892.txt-1058-25,3 Closely Related,"This Angel, who was once in Heaven above, Whose living heartstrings are a lute; This Star which circled in the Courts of Love, For whose long absence now the rest are mute -- Is here on earth! || This Angel, who was once in Heaven above, Whose living heartstrings are a lute; This Star which circled in the Courts of Love, For whose long absence now the rest are mute -- Is here on earth!"
