annotation_lbl,category,sentence
edge_fic_1975_10598.txt-6073-22_edge_nf_1841_747926.txt-651-45,Identical,"We walked the fifty yards up to a washy-looking razorback, and Tracker pointed to a couple of clear footprints at the edge of a dry claypool. "" || Trees of medium and smaller size should be so interspersed with those of larger growth, as to break up all formal sweeps in the line produced by the tops of their summits, and occasionally, low trees should be planted on the outer edge of the mass, to connect it with the humble verdure of the surrounding sward."
edge_fic_1985_10731.txt-8264-5_edge_mag_1851_525821.txt-323-0,Identical,"He pushed it over the edge and leaped after it. || edge of a steep slope of this rubbish, sending the stones at every step rolling and bounding into the depth below."
edge_fic_1985_10731.txt-8264-5_edge_mag_2003_399610.txt-496-37,Closely Related,"He pushed it over the edge and leaped after it. || It was important to call it my own, and my father had agreed that I could, if I made a spillway with my fieldstone dam that would direct the slow trickle away from the lower edge of their gardens below"
edge_fic_1987_23990.txt-44-12_edge_fic_1975_10598.txt-6073-22,Identical,"I sensed their bad intent as they passed us, an unpleasant edge of excitement in their looks and greetings. || We walked the fifty yards up to a washy-looking razorback, and Tracker pointed to a couple of clear footprints at the edge of a dry claypool. """
edge_fic_1987_780087.txt-2935-4_edge_fic_1823_7249.txt-942-61,Identical,"Sammy rushed around the edge of the vat to a panel halfway across the room, exclaiming, "" I 'm going to get serum for my mate! "" || I looked a moment though I was hotly engaged with two good swordsmen, in the expectation of seeing him fall; but, in a twinkling, he was out of sight, his blade rattling like hail, about the bayonets that hedged him in, as he passed in a circle of incessant fire, giving point and edge, at the same moment."
edges_nf_1854_750818.txt-2813-25_edge_fic_1987_23990.txt-44-12,Closely Related,"Soon, all along the now desolate shores of the Forth and Clyde, villas and pleasure grounds would be as thick as along the edges of the Dutch canals. || I sensed their bad intent as they passed us, an unpleasant edge of excitement in their looks and greetings."
edges_nf_1854_750818.txt-2813-25_edge_fic_1994_41254.txt-44-18,Identical,"Soon, all along the now desolate shores of the Forth and Clyde, villas and pleasure grounds would be as thick as along the edges of the Dutch canals. || Not a hair on that tail, which was at least two feet long and whipped over the edge of the sink like a wiry piece of rope."
face_fic_1827_7169.txt-1862-5_face_fic_1996_54394.txt-2232-9,Identical,"he gazed on the furrowed face of his parent; but the orbs of the old man were hot, burning, and dry as a fountain channel in the desert when the Simoon had passed -- a stern and melancholy darkness of mind was on them unbroken by a glimmer of light. || He smiled, his teeth white in his dark face. """
face_fic_1841_7000.txt-850-9_face_fic_1853_9040.txt-3170-14,Identical,"Her voice died on her lips, and her face became colorless || She was amiable and good in all ways; the everlasting smile on her face did not belie her heart."
face_fic_1848_7193.txt-10499-29_face_news_1994_614387.txt-73-21,Identical,"I had escaped the grave -- I knew no more -- "" After a troubled sleep, broken by a frightful dream, -- in which I saw his face and the uplifted knife -- I woke once more, and became conscious that a woman's form was slumbering at my side. || So, wow, who-da thunk Georgia offensive coordinator Wayne "" Wild Man "" McDuffie, who once spit in the face of a reporter, could have gotten into a shouting match with Dogs offensive guard Steve Roberts?"
face_fic_1853_9158.txt-1194-47_face_fic_1841_7000.txt-850-9,Distantly Related,"But for once the routiers kept faith -- the din ceased in the encampment, the lights went out one by one, and silence of dewy night fell over tent and bivouac as peacefully as if the deadliest of foes were not almost arrayed beneath it face to face. || Her voice died on her lips, and her face became colorless"
face_fic_1971_782006.txt-553-8_face_fic_1827_7169.txt-1862-5,Identical,"Noting the expression on the young man's face she added sharply, "" Are you all right? "" || he gazed on the furrowed face of his parent; but the orbs of the old man were hot, burning, and dry as a fountain channel in the desert when the Simoon had passed -- a stern and melancholy darkness of mind was on them unbroken by a glimmer of light."
face_fic_1971_782006.txt-553-8_face_fic_1853_9040.txt-3170-14,Identical,"Noting the expression on the young man's face she added sharply, "" Are you all right? "" || She was amiable and good in all ways; the everlasting smile on her face did not belie her heart."
face_fic_1971_782006.txt-553-8_face_fic_1999_44469.txt-416-0,Identical,"Noting the expression on the young man's face she added sharply, "" Are you all right? "" || face; his neat mustache had flecks of gray in it."
face_fic_1996_54394.txt-2232-9_face_fic_1988_780086.txt-3273-17,Identical,"He smiled, his teeth white in his dark face. "" || As he talked, Endor sat up straighter, clenching the armrests of his throne, his face dark with anger."
face_mag_1834_554263.txt-165-90_face_fic_1841_7000.txt-850-9,Distantly Related,"They had stolen two days ' march upon the English army, before the Duke of Cumberland knew any thing of their movements: but when it was ascertained that they had aclually commenced their retreat, his courage and that of his army began to rise; it seemed to be the first time they had breathed freely for six weeks, during which a small and ill appointed force had carried the standard of Glenfinnin a hundred and fifty miles into the heart of England, in the face of a hostile people, and of an army which immeasurably exceeded theirs in discipline and numbers. || Her voice died on her lips, and her face became colorless"
face_news_1994_614387.txt-73-21_face_fic_2003_28322.txt-2-8,Distantly Related,"So, wow, who-da thunk Georgia offensive coordinator Wayne "" Wild Man "" McDuffie, who once spit in the face of a reporter, could have gotten into a shouting match with Dogs offensive guard Steve Roberts? || Upstream where the forest thinned under the cliff face, a lone company of soldiers slogged wearily through the mud, heads down, shoulders hunched against the heavens ' fury."
fiction_mag_1834_564699.txt-298-31_fiction_nf_2004_746778.txt-6-32,Identical,"Thus, if we have no royal road to knowledge, we have, what is much more agreeable, a "" primrose path, "" strewed with the flowers of fiction, which leads not only to heaven, but to the summit of every || fiction affords "" (cover of The Corrections) and with the pleasures themselves, indeed so familiar that we rarely enquire into the state of mind that renders such responses to fiction possible."
fiction_mag_1835_554358.txt-93-7_Fiction_fic_1843_7074.txt-24-28,Closely Related,"How happily must the brilliant drapery of fiction be wrapped around the severe beauty of moral instruction, when || Let the book pass for what it is worth: if taken for History, it will be thought I had a somewhat remarkable experience, if for Fiction, that I have tolerable Invention; and then my scull will be in the market -- for the booksellers in my lifetime, -- and the Phrenologists afterwards."
fiction_mag_1978_319925.txt-11-20_fiction_fic_2002_32251.txt-33-14,Identical,"Shaw spent five decades writing big movies and novels (The Young Lions, Lucy Crown) and unprofitable short fiction, because "" in a novel or a play you must be a whole man. || Gernsback opens his first editorial for Amazing by referring to the overwhelming number of fiction magazines at the time: "" Another fiction magazine! """
fiction_mag_1986_332364.txt-5-14_fictions_fic_1989_14343.txt-309-40,Identical,"For example, in Books we talk about that distinctive American contribution to detective fiction, the hard-boiled hero. || FIRST GIRL Yet, there is abundant evidence from their songs and cherished traditions that Australian aborigines are by no means destitute of some qualities in which civilized men glory, such as the power of inventing tragic and sarcastic fictions, the thirst for religious mystery, contempt for pain, and reverence for departed friends and ancestors."
fiction_nf_1997_773614.txt-641-8_fiction_fic_1997_42375.txt-311-4,Unrelated,"Looking back, it seemed useful training for fiction, requiring him to present dramatic material in dramatic fashion. || Among his books of fiction are In Silence There Are Ghosts (Baker Book House), a novel, and The Secrets of Barneveld Calvary (Baker Book House), a cycle of stories published earlier this year."
fiction_nf_1997_773614.txt-641-8_fictions_mag_1849_565817.txt-102-103,Identical,"Looking back, it seemed useful training for fiction, requiring him to present dramatic material in dramatic fashion. || professions, that they afterwards learn, in some incidental way, from those who met the subject of the memoir in daily life, that he was cold and repulsive to his brethren; that the ardor of his devotion and the spirituality of his conversation and his written reflections, had much to do with an extraordinary nervous excitability, and that the mind, which seemed to rise and soar with an an gel's wing to the comprehension of things eternal and invisible, found its favorite arid constantly demanded stimulus, in tIie reading of extravagant and romantic fictions."
fictions_fic_1989_14343.txt-309-40_Fiction_mag_1851_555692.txt-245-8,Unrelated,"FIRST GIRL Yet, there is abundant evidence from their songs and cherished traditions that Australian aborigines are by no means destitute of some qualities in which civilized men glory, such as the power of inventing tragic and sarcastic fictions, the thirst for religious mystery, contempt for pain, and reverence for departed friends and ancestors. || // A book entitled "" Truth Stranger than Fiction, "" which lies at our elhoxv among other books written by ladies, has in some measure influenced the direction of our remarks upon female privilege and authorship."
fictions_mag_1849_565817.txt-102-103_fiction_mag_1965_488192.txt-74-58,Closely Related,"professions, that they afterwards learn, in some incidental way, from those who met the subject of the memoir in daily life, that he was cold and repulsive to his brethren; that the ardor of his devotion and the spirituality of his conversation and his written reflections, had much to do with an extraordinary nervous excitability, and that the mind, which seemed to rise and soar with an an gel's wing to the comprehension of things eternal and invisible, found its favorite arid constantly demanded stimulus, in tIie reading of extravagant and romantic fictions. || The revelations of the Twentieth Congress of the Soviet Communist Party threw a glaring light on some of the crevices; yet even the IChrushchey speech posed new questions rather than furnished answers Observing these new conflicts and taking part in them, defining the new questions and searching for answers to them by using the resources of fiction is a thrilling challenge The writer may have a tough time of it; his findings may not agree with official requirements, he may even touch a neuralgic point -- this does not change the writer's duty nor detract from the fascination of the job."
gas_fic_1839_7023.txt-797-19_gas_news_2005_608686.txt-4-27,Identical,"Long wreaths of greens and paper roses, were suspended from the pillars of the hall, and the gas lights burned with a brilliancy which made every thing short of liquid rouge look pale. || American Electric Power said it will pay $81 million to settle a lawsuit and investigations by federal regulators who accused the utility's traders of manipulating natural gas prices."
gas_fic_1992_40319.txt-74-22_gas_fic_2004_49256.txt-152-8,Identical,"Air-raid sirens have sounded in Tel Aviv, the correspondent in that city tells us, speaking through the absurd yet frightening gas mask that causes him to resemble an oversized anteater. || He was alone, lost in a green gas world of silence forever."
gas_mag_1846_555416.txt-42-18_gas_nf_1845_747928.txt-906-7,Identical,"A pint of oil when burned produces a pint and a quarter of water; a pound of gas, more than two and a half pounds of water. || The odour of the coal tar of gas works is exceedingly offensive to some insects injurious to fruits, and it has been found to drive away the wire worm, and other"
gas_nf_1844_755204.txt-629-14_gas_mag_1840_554766.txt-186-1,Identical,"There can be little doubt that the infusion of a large dose of this gas into the atmosphere at the present day would be attended by precisely the same circumstances as in the time of the carboniferous formation. || explosive gas, so much talked of, has, by the way, never yet been detected by the researches of science."
gas_nf_1845_747928.txt-906-7_gas_mag_1854_555930.txt-121-17,Identical,"The odour of the coal tar of gas works is exceedingly offensive to some insects injurious to fruits, and it has been found to drive away the wire worm, and other || to an inadequate amount of fresh air, and also furnished no stinted supply of smoke or gas."
gas_nf_1845_747928.txt-906-7_gas_news_2005_608686.txt-4-27,Unrelated,"The odour of the coal tar of gas works is exceedingly offensive to some insects injurious to fruits, and it has been found to drive away the wire worm, and other || American Electric Power said it will pay $81 million to settle a lawsuit and investigations by federal regulators who accused the utility's traders of manipulating natural gas prices."
gas_nf_1848_747893.txt-3400-18_gas_fic_1992_40319.txt-74-22,Identical,"I have never noticed any effect produced upon the foliage of tree or herb from the odor or gas arising therefrom. || Air-raid sirens have sounded in Tel Aviv, the correspondent in that city tells us, speaking through the absurd yet frightening gas mask that causes him to resemble an oversized anteater."
gases_mag_1992_395995.txt-193-16_gas_nf_1845_747928.txt-906-7,Identical,"Neither gas respects landfill boundaries: tests done in California have shown that illegal levels of gases accumulate not only over landfills but over nearby residential areas as well. || The odour of the coal tar of gas works is exceedingly offensive to some insects injurious to fruits, and it has been found to drive away the wire worm, and other"
gases_nf_1843_752682.txt-209-1_gas_mag_1835_554331.txt-58-8,Identical,"Some gases are absorbed and condensed within the pores of the charcoal, into a space several hundred times smaller than they before occupied; and there is now no doubt they there become fluid, or assume a solid state. || Clear as crystal) sparkling with carbonic acid gas, and effervescing quite as much as champagne, it was nevertheless miserably cold; and the first morning, what with the gas, and what with the low temperature of this cold iron water, it was about as much I could do to swallow it; and, for a few seconds, feeling as if it had sluiced my stomach completely by surprise, I stood hardly knowing what was about to happen; when, instead of my teeth chattering as I expected, I felt the water suddenly grow warm within my waistcoat, and a slight intoxication, or rather exhilaration, succeeded"
gases_nf_1843_752682.txt-216-4_gases_nf_1848_747893.txt-3135-42,Identical,"This property of absorbing gases varies with different kinds of charcoal: it is possessed in a higher degree by those containing the most pores, i.e. where the pores are finer; and in a lower degree in the more spongy kinds, i.e. where the pores are larger. || But it is not alone by their direct action, that they affect plants injuriously; the putrid gases which they give out, are destructive to the young stems and foliage of plants, in proportion to their strength; such gases are, up to a certain point, absolute poisons, although, below that point, they are nutritious."
graft_mag_1976_291145.txt-21-13_graft_nf_1839_747931.txt-291-1,Distantly Related,"Among its first official acts was the appointment of a committee to probe graft. || The graft is prepared by cutting it in a sloping manner in a reverse position, so that when placed on the cut of the stock it forms a neat splice."
graft_nf_1839_747931.txt-304-51_graft_mag_1969_214820.txt-18-23,Identical,"Place the part of the shoot to the stock, then with a sharp knife pare off part of the branch and stock so as to make a neat splice in precisely the same manner as the whip-graft; the part united is then to be bandaged and covered as the graft, and in every way managed in the same manner. || When any vertebrate animal is "" invaded "" by foreign proteins-whether bacteria, viruses, or tissues from another animal as in a graft or transplant-the invaders soon meet one of the host's body cells that is armed with the appropriate antibody."
graft_nf_1839_747931.txt-304-51_graft_mag_1976_291145.txt-21-13,Unrelated,"Place the part of the shoot to the stock, then with a sharp knife pare off part of the branch and stock so as to make a neat splice in precisely the same manner as the whip-graft; the part united is then to be bandaged and covered as the graft, and in every way managed in the same manner. || Among its first official acts was the appointment of a committee to probe graft."
graft_nf_1850_747863.txt-325-14_graft_nf_1839_747931.txt-304-51,Unrelated,"Hence there are two chief requisites for success: the first, that the graft be so set in the stock, that the sap may flow upward without interruption; and the second, that the forming wood /z/ may flow downward uninterruptedly through the inner bark. || Place the part of the shoot to the stock, then with a sharp knife pare off part of the branch and stock so as to make a neat splice in precisely the same manner as the whip-graft; the part united is then to be bandaged and covered as the graft, and in every way managed in the same manner."
graft_nf_1850_747863.txt-878-32_grafts_mag_1851_566097.txt-140-28,Unrelated,"But this can only be true with very small trees or seedlings, which quickly reproduce a multitude of small roots, after the top is removed for the insertion of a graft; or where the fibres of larger trees have been killed by exposure after removal, and which are followed by a necessary lopping of the branches. || Wherever there is an old pear tree, bearing those miserable representations of that fruit, that we see in most of our country towns, a few grafts of fine varieties put into its top, will in two or three years bear such specimens as can not be excelled for beauty and flavor."
graft_nf_1858_747890.txt-628-32_graft_nf_1980_774261.txt-641-30,Closely Related,"The graft should be in a less advanced condition than the stock, as during the process of adhesion, evaporation from the bark goes on rapidly when the sap in the graft is active, and death ensues, because the supply can not be maintained. || Lung transplants done in 32 patients during the last ten years have been quite disappointing, with only 3 patients living for more than thirty days | with a functioning graft."
grafts_nf_1858_747890.txt-606-43_graft_nf_1839_747931.txt-294-29,Distantly Related,"It would be more nearly correct to say, that the, duration of a variety is limited more or less by that of its original, and that any inherent disease in it will be continued, in all its buds and grafts, although the superior vitality of the stock may mitigate its virulence, or protract its dormant period. || When the graft is set, it is to be bound with bass-string, beginning at the bottom and winding it upwards in a gradual manner, When the graft is bandaged, it is to be covered with clay or other composition in the same manner as directed for the cleft-graft."
head_fic_1967_10489.txt-6620-6_head_fic_1998_29903.txt-225-3,Identical,"There I stood in my bald head and my sport shirt, obviously not the police. || She turned her head, her dark Italian eyes laughing. """
head_fic_1984_780041.txt-2502-23_head_fic_1993_1040073.txt-3998-3,Identical,"On the bed was Joel Converse, his eyes wide and glasslike, saliva oozing from the sides of his mouth, his head moving back and forth as if in a trance, unintelligible sounds emerging from his lips. || He shakes his head as though he's trying to wake himself up."
head_fic_1993_1040073.txt-3998-3_head_mag_1847_565707.txt-376-5,Distantly Related,"He shakes his head as though he's trying to wake himself up. || In our remarks on this head, we have limited ourselves chiefly to the progress of civil liberty and popular power -- a single aspect of the subject, otherwise too vast for a single essay."
head_fic_1998_29903.txt-225-3_head_fic_1851_2538.txt-1907-3,Identical,"She turned her head, her dark Italian eyes laughing. "" || The lion's head looked down with a grimly good-natured aspect, as the children clustered around the old gentleman's knees."
head_fic_2001_55631.txt-253-15_head_fic_1999_44266.txt-98-11,Identical,"I swear, my mouth was so wide, Jeff could have fit his entire head inside it. || Jill, who had been sitting on the couch with her head resting on Steve's shoulder, sat up, alert. """
heads_fic_2009_36730.txt-97-4_head_fic_1853_9040.txt-2752-12,Identical,"Anger-plagued enrollees cocked their heads to the side like curious spaniels. "" || No, "" he answered; and replacing the hat on his head"
land_fic_1844_7426.txt-470-9_landing_nf_1995_777121.txt-337-16,Closely Related,"from Poems (1844) Birds fly away over land and sea, Seeking their sunny home; The winds are wandering strong and free, Wherever they choose to roam. || I looked up and stood dumbstruck to see an actual airplane come stuttering down to a landing - just like in the movie Wings."
land_fic_1966_10481.txt-1732-17_land_mag_1860_527181.txt-175-1,Identical,"Barbarians ' were allowed to build warehouses andTAI-PAN (72) BOOK Ifactories on a plot of land half a mile by two hundred yards at Canton; ' barbarians ' were totally confined to this walled-in area -- the Canton Settlement -- andcould stay only for the winter shipping season -- September until March -- when they must leave and go to Macao. || The land is also rich in the common metals, the production of which, as well as of gold and silver, would be incalculably increased, should Mexico pass under the dominion"
land_fic_1966_10481.txt-1732-17_lands_nf_1997_776918.txt-41-31,Closely Related,"Barbarians ' were allowed to build warehouses andTAI-PAN (72) BOOK Ifactories on a plot of land half a mile by two hundred yards at Canton; ' barbarians ' were totally confined to this walled-in area -- the Canton Settlement -- andcould stay only for the winter shipping season -- September until March -- when they must leave and go to Macao. || Although he did rescue Kiev from the Pechenegs (a nomadic Turkic population that occupied the steppe) in 968, Sviatoslav devoted most of his attention to establishing control over lands on the Danube river."
land_fic_1966_781993.txt-1898-33_land_nf_1973_773528.txt-286-11,Identical,"Once they held large holdings of land, but they began to lose it, plot after plot, in all the ways a family destined for disaster can find to lose its land. || development of an economic surplus, the differential possession of the land and its fruits became an additional criterion for evaluating families and individuals."
land_mag_1860_527181.txt-175-1_land_nf_1966_774177.txt-996-10,Identical,"The land is also rich in the common metals, the production of which, as well as of gold and silver, would be incalculably increased, should Mexico pass under the dominion || From the taro swamps immediately behind the limestone plateau the land rises to low volcanic hills, an extensive area of which has been planted with albizzia trees."
land_nf_1967_774106.txt-667-17_land_fic_1966_781993.txt-1898-33,Identical,"The knights are satisfied; they can now rest assured that baronial government will not subvert their land tenures. || Once they held large holdings of land, but they began to lose it, plot after plot, in all the ways a family destined for disaster can find to lose its land."
land_nf_1973_773528.txt-286-11_lands_nf_1833_747716.txt-366-18,Unrelated,"development of an economic surplus, the differential possession of the land and its fruits became an additional criterion for evaluating families and individuals. || those sections, his conclusion was, that the ordinance contained no authority to a sub-delegate to grant lands in reward of any other services, of which description were those rendered by Soulard."
landing_nf_1995_777121.txt-337-16_land_nf_1967_774106.txt-667-17,Unrelated,I looked up and stood dumbstruck to see an actual airplane come stuttering down to a landing - just like in the movie Wings. || The knights are satisfied; they can now rest assured that baronial government will not subvert their land tenures.
landing_nf_1995_777121.txt-337-16_land_nf_1973_773528.txt-286-11,Unrelated,"I looked up and stood dumbstruck to see an actual airplane come stuttering down to a landing - just like in the movie Wings. || development of an economic surplus, the differential possession of the land and its fruits became an additional criterion for evaluating families and individuals."
lands_mag_1822_553415.txt-22-1_land_fic_1975_10595.txt-3906-6,Unrelated,"He lands among us, falls into some circle, good or bad, as the case may be, hears them speak in strong terms of their party adversaries, is able to make none of that secret || I 'm not sure how much land and what kind of land can tolerate that much water."
